title,desc,user_registered,offer_posted,url
"Instrukcja Nikon AF Zoom-Nikkor 28-80 f 3,3-5,6 G"," Witam serdecznie, Do sprzedania oferuję oryginalną instrukcję do obiektywu Nikon AF Zoom-Nikkor 28-80 mm f/3.3 - 5.6 G. Instrukcja w formie klasycznej Nikonowskiej ""rozkładanki"". Papier offsetowy, matowy. Zawiera informacje na temat obsługi, kompatybilności z pomiarem światła w rozmaitych modelach aparatów Nikona oraz kompatybilności filtrów i akcesoriów. Tekst w językach: - japońskim - angielskim - niemieckim - francuskim - hiszpańskim - włoskim - koreańskim - chińskim STAN: Instrukcja używana ale w bardzo dobrym stanie zachowania - pozostała mi po dawno sprzedanym obiektywie. PŁATNOŚĆ, ODBIÓR, WYSYŁKA: Zakup możliwy poprzez kontakt przez wiadomość prywatną, gdzie sprzedający i kupujący uzgodnią warunki transakcji. Możliwy (i mile widziany) odbiór osobisty w Starej Wsi koło Brzozowa (woj. podkarpackie). Wysyłka możliwa po wcześniejszej przedpłacie na konto bankowe. Koszt: - list polecony ekonomiczny (8 zł) - list polecony priorytetowy (10 zł) Nie wysyłam za pobraniem ani paczkomatami. Serdecznie zapraszam do zakupu oraz przejrzenia pozostałych moich ogłoszeń (gdzie można znaleźć więcej albumów, książek, czasopism i katalogów fotograficznych). ",Mar 2021,20 Maj 14:26,https://sprzedajemy.pl/skrzynia-biegow-20dp35-fiat-peugeot-citroen-1-6-regeneracja-ryki-2-6bea9f-nr67631548
MITSUBISHI COLT CZ3 lampa tył lewa 3D, MITSUBISHI COLT CZ3 3-drzwiowy lampa tył lewa cena 30zl Kielce telefon 517--965--401 ,Mar 2022,20 Maj 14:15,https://sprzedajemy.pl/skrzynia-biegow-20dp35-fiat-peugeot-citroen-1-6-regeneracja-ryki-2-6bea9f-nr67631548
hyundai coupe tasma airbag, hyundai coupe tasma airbag cena 40zl Kielce telefon 517 965 401 ,Mar 2022,20 Maj 14:14,https://sprzedajemy.pl/skrzynia-biegow-20dp35-fiat-peugeot-citroen-1-6-regeneracja-ryki-2-6bea9f-nr67631548
"Portret ołówkiem ze zdjęcia na zamówienie A4, A3, A2, A1"," Dzień dobry! :-)  Oferuję portrety oraz karykatury na zamówienie, rysowane ze zdjęcia ołówkami.  To ogłoszenie dotyczy PORTRETÓW. Prace rysowane są bardzo dobrej jakości ołówkami firmy KOH-I-NOOR, na papierze o wysokiej gramaturze. Portret jest rysowany w formie popiersia, bez tła. Inna forma ukazania osób wymaga uzgodnienia. Po wykonaniu portrety zabezpieczane są fiksatywą. Portrety są sygnowane. Portrety nie są oprawione. Cennik:  Portret A4 (21 cm na 29,7 cm): jedna osoba – 140 zł dwie osoby – 170 zł Portret A3 (29,7 cm na 42 cm) jedna osoba – 170 zł dwie osoby – 200 zł trzy osoby – 230 zł cztery osoby – 260 zł Portret A2 (42 cm na 59,4 cm) jedna osoba – 220zł dwie osoby – 270 zł trzy osoby – 320 zł cztery osoby – 370 zł Portret A1 (59,4 cm na 84,1 cm) jedna osoba – 370zł dwie osoby – 420 zł trzy osoby – 470 zł cztery osoby – 520 zł * WYSYŁKA GRATIS * Wysyłam za pośrednictwem Kuriera Inpost lub Paczkomatów Inpost.  Jak zamówić portret? 1. Prześlij zdjęcie lub zdjęcia z którego ma zostać wykonany portret. Mogą to być osobne zdjęcia, które połączę w jedną całość. Jeżeli potrzebujesz portret na jakiś konkretny termin - proszę o informacje przy wysyłce zdjęcia:) Zawsze staram dopasować termin do klienta, jeśli tylko mam taką możliwość :) Zdjęcie musi być jak najlepszej jakości, o dużej rozdzielczości. Sprawdzę, czy mogę wykonać dla Ciebie portret na podstawie danej fotografii. 2. Po zaakceptowaniu przeze mnie zdjęcia należy wpłacić 50% zaliczki. Po otrzymaniu zaliczki zaczynam pracę nad portretem. 3. Wykonuję zamówiony portret, a efekt końcowy przesyłam do wglądu przed wysyłką. Na tym etapie możliwe są drobne poprawki. 5. Po zaakceptowaniu przez Ciebie portretu i wpłaty pozostałej kwoty wyrusza on w podróż pod wskazany adres. Praca pakowana jest bezpiecznie w gruba tekturową tubę.  Wysyłam za pośrednictwem Kuriera Inpost lub Paczkomatów Inpost. Koszt wysyłki 20 zł.  Zapraszam do kontaktu, wszelkie szczegóły zamówienia omawiam e-mailowo, aby mieć wszystkie najważniejsze informacje na temat zamówienia w jednym miejscu, wówczas też Państwo maja pewność, że wszystko zostało poprawnie ustalone, jeśli będzie potrzebne jakieś doprecyzowanie wówczas dopiero możliwy jest kontakt telefoniczny:-)  Pozdrawiam Łukasz ",Kwi 2023,20 Maj 14:40,https://sprzedajemy.pl/skrzynia-biegow-20dp35-fiat-peugeot-citroen-1-6-regeneracja-ryki-2-6bea9f-nr67631548
"Obciążniki Massey Ferguson komplet,balast, obciążnik"," Witam. Sprzedam komplet obciążników do ciągnika Massey Ferguson, 12 sztuk w wadze 45kg sztuka oraz podwójny zaczepowy.Polecam ",Gru 2020,20 Maj 14:23,https://sprzedajemy.pl/skrzynia-biegow-20dp35-fiat-peugeot-citroen-1-6-regeneracja-ryki-2-6bea9f-nr67631548
"Żaglówka, łódź żaglowa, omega, 420, jacht"," Na sprzedaż markowa żaglówka z Niemieckiej stoczni. Idealny sprzęt dla osób początkujących oraz doświadczonych. Ożaglowanie, kadłub(oryginalny żelkot na burtach) oraz osprzęt w stanie bardzo dobrym - użytkowana była na weekendowe rejsy. Łódź przeznaczona dla 2 osób, jednak swobodnie na niej pływają nawet 3/4 osoby dorosłe. Rozłożenie oraz przygotowanie żaglówki nie stanowi problemu nawet dla jednej osoby. Łódź jest zwinna i lekka. Uchylne płetwy pozwalają na przybicie do samego brzegu, posiada pojemną bakistę dziobową, pasy balastowe ,markowy osprzęt HS, szyny foka, markowe aluminiowe omasztowanie oraz żagle w bardzo dobrym stanie. Cały osprzęt jest sprawny i kompletny. Łódź gotowa do pływania, sucha - nie bierze wody, przechowywana w zimę zawsze w ogrzewanym pomieszczeniu. Żaglówka przygotowana do następnego sezonu - przy łódce nie trzeba całkowicie nic robić. Wymiary: Długość: 415cm Szeroko: 170cm, Waga: ok. 150kg Zanurzenie: 10-90cm(z opuszczoną płetwą mieczową), Długość masztu: 6 metrów, Powierzchnia żagli: 11,6m² Wózek widoczny na zdjęciach nie jest na sprzedaż. ",Wrz 2013,20 Maj 14:30,https://sprzedajemy.pl/skrzynia-biegow-20dp35-fiat-peugeot-citroen-1-6-regeneracja-ryki-2-6bea9f-nr67631548
granulat styropian regranulat styrobeton wypełnienie," Oferuję regranulat styropianowy pakowany w worki 200l - 0,2 m3, oraz 500l - 0,5 m3 Worek 200l - 25 zł Worek 500l - 50 zł Może być zastosowany: - do wypełnień szczelin metodą wdmuchiwania - w innych zastosowaniach termoizolacyjnych - do wypełniania puf, siedzisk - jako dodatek do styrobetonu - do spulchniania gleby Możliwy transport na terenie Szczecina i okolic, po wcześniejszym ustaleniu kosztów. Wystawiam fakturę VAT. 6*9*2*9*4*1*0*1*8 ",Gru 2022,20 Maj 14:24,https://sprzedajemy.pl/skrzynia-biegow-20dp35-fiat-peugeot-citroen-1-6-regeneracja-ryki-2-6bea9f-nr67631548
Usługi spawalnicze - Spawanie mobilne z dojazdem do klienta, Oferuję usługi spawalnicze / ślusarskie: - stal czarna; - aluminium; - stal nierdzewna; Istnieje możliwość dojazdu na miejsce i wykonanie usługi pod adresem klienta Zapraszam do kontaktu ,Cze 2019,20 Maj 14:35,https://sprzedajemy.pl/skrzynia-biegow-20dp35-fiat-peugeot-citroen-1-6-regeneracja-ryki-2-6bea9f-nr67631548
Łańcuszek styl versace," Polecam śliczny łańcuszek z zawieszką w stylu Versace. Naszyjnik jest w kolorze złotym. Łańcuszek ma długość 76 cm , wisiorek ma 3 cm średnicy. Na innej mojej aukcji dostępny pierścionek oraz kolczyki do kompletu ! Koszt przesyłki 6,80 zł list polecony lub paczkomat 14,69 zł ",Sie 2015,20 Maj 14:24,https://sprzedajemy.pl/skrzynia-biegow-20dp35-fiat-peugeot-citroen-1-6-regeneracja-ryki-2-6bea9f-nr67631548
Gaźnik ikov Żuk warszawa nysa, Sprzedam gaźnik ikov do Żuk nysa warszawa. Stan nieznany.Dostępne 2szt.Podana cena za jeden. Możliwa wysyłka ,Kwi 2016,20 Maj 14:12,https://sprzedajemy.pl/skrzynia-biegow-20dp35-fiat-peugeot-citroen-1-6-regeneracja-ryki-2-6bea9f-nr67631548
dres zielony lemonada 38/40 hit, sprzedam rewelacyjny dres sportowy lemonada 40 idealne na wiosne/lato nowa kolekcja dwa razy założony zapraszam rewelacyjny :) ,Lip 2018,20 Maj 14:27,https://sprzedajemy.pl/skrzynia-biegow-20dp35-fiat-peugeot-citroen-1-6-regeneracja-ryki-2-6bea9f-nr67631548
silnik elektryczny 285kW 1487obr. OBCE CHŁODZENIE EMIT," silnik elektryczny trójfazowy niezależne chłodzenie silnika czujniki temperatury uzwojenia czujniki temperatury łożysk izolowana tarcza łożyskowa tylna (do pracy z falownikiem) nowe łożyska FAG 285kW 1487obr. EMIT (po remoncie, gotowy do pracy) średnica wału: 100mm rozruch: gwiazda-trójkąt - 400V∆ wielkość mechaniczna: 355 waga: 1710kg termin realizacji: 2-3dni wystawiamy faktury VAT cena BRUTTO GWARANCJA 12 miesięcy możliwa wysyłka kurierem więcej silników znajdziesz w naszych ogłoszeniach ",Mar 2018,20 Maj 14:32,https://sprzedajemy.pl/skrzynia-biegow-20dp35-fiat-peugeot-citroen-1-6-regeneracja-ryki-2-6bea9f-nr67631548
Mieszkanie po kancelarii adwokackiej w dobrym stanie," OGŁOSZENIE BEZPOŚREDNIE - BEZ PROWIZJI Słoneczne i o dobrej energii mieszkanko w starej kamienicy z czasu I wojny światowej sprzedam. wysokość : 273 cm, 3 pokoje o m2 : 23/15/20, kuchnia ok 15m, łazienka z wejściem z kuchni ok 8 m, wc ok 2 m, przedpokój : 2 m. Mieszkanie ma okna na północ i jedne pokój na północny zachód - mimo tego, jest bardzo jasne, duże okna i brak zabudowań przed lokalem. Ogrzewanie elektryczne z pieców przedwojennych, stylowa klatka schodowa. Pilne Ogłoszenie dodane do 100 portali nieruchomości przez portal www.**************** ",Maj 2019,20 Maj 14:21,https://sprzedajemy.pl/skrzynia-biegow-20dp35-fiat-peugeot-citroen-1-6-regeneracja-ryki-2-6bea9f-nr67631548
Router mobilny LTE Airbox - A252," W pełni sprawny, w b. dobrym stanie router Airbox - 252 ",Mar 2014,20 Maj 14:21,https://sprzedajemy.pl/skrzynia-biegow-20dp35-fiat-peugeot-citroen-1-6-regeneracja-ryki-2-6bea9f-nr67631548
KLOCKI HAMULCOWE LUCAS MCB548  FXD1340 Dyna FXE 1340," Klocki dedykowane są do motocykli o pojemności od 125cc do 1000 cc, rekomendowane przez producenta do motocykli o szosowym i miejskim charakterze.                          ZASTOSOWANIE  HARLEY DAVIDSON FLHR 1340 Electra Glide Road King FD 1994-1998  HARLEY DAVIDSON FLHR 1450 Elektra Glide Road King FDV 1999  HARLEY DAVIDSON FLHRCI 1340 EFI Elektra Glide Road King CL 1998 -1999  HARLEY DAVIDSON FLHRI 1340 EFI Electra Glide Road King FB 1996-1997  HARLEY DAVIDSON FLHRI 1340 EFI Electra Glide Road King FSR 1998  HARLEY DAVIDSON FLHS 1340 Electra Glide Sport 1987-1990  HARLEY DAVIDSON FLHS 1340 Electra Glide Sport FA 1991-1998  HARLEY DAVIDSON FLHT 1450 Electra Glide Standard DDV 1999  HARLEY DAVIDSON FLHTC 1340 Electra Glide Classic DD 1984-1985  HARLEY DAVIDSON FLHTC 1340 Electra Glide Classic DJ 1986-1998  HARLEY DAVIDSON FLHTCI 1340 EFI Electra Glide Classic FF 1996-1998  HARLEY DAVIDSON FLHTCU 1340 Electra Glide Ultra Classic DP 1989-1998  HARLEY DAVIDSON FLHTCUI 1340 EFI Electra Glide Ultra Classic FC 1996-1998  HARLEY DAVIDSON FLHTCUI 1450 EFI Elektra Glide Ultra Classic FFW 1999  HARLEY DAVIDSON FLST 1340 Heritage Softail 1987-1990  HARLEY DAVIDSON FLST 1340 Heritage Softail BHH 1986  HARLEY DAVIDSON FLSTC 1340 Heritage Softail Classic BJ 1988-1999  HARLEY DAVIDSON FLSTF 1340 Fat Boy BM 1990-1999  HARLEY DAVIDSON FLSTN 1340 Heritage Softail Nostalgia 1993  HARLEY DAVIDSON FLSTN 1340 Heritage Softail Special 1994-1996  HARLEY DAVIDSON FLSTS 1340 Heritage Softail Springer BR 1997-2002  HARLEY DAVIDSON FLSTS 1450 Heritage Springer BRY 2003  HARLEY DAVIDSON FLSTSCI 1450 EFI Softail Springer Classic BYB 2005-2006  HARLEY DAVIDSON FLT 1340 Tour Glide 1984-1992  HARLEY DAVIDSON FLTC 1340 Tour Glide Classic 1989-1993  HARLEY DAVIDSON FLTC 1340 Tour Glide Classic DB 1984-1992  HARLEY DAVIDSON FLTRI 1450 EFI Elektra Glide Road Glide FSW 1999-2000  HARLEY DAVIDSON FLTRI 1450 Elektra Glide Road Glide FSW 1999-2000  HARLEY DAVIDSON FXD 1340 Dyna Super Glide GH 1995-1998  HARLEY DAVIDSON FXD 1450 Dyna Super Glide 1999  HARLEY DAVIDSON FXDB 1340 Dyna Street Bob 1991-1992  HARLEY DAVIDSON FXDL 1340 Dyna Glide Low Rider 1993-1994  HARLEY DAVIDSON FXDL 1340 Dyna Glide Low Rider GD 1995-1998  HARLEY DAVIDSON FXDL 1450 Dyna Low Rider GD 1999  HARLEY DAVIDSON FXDS-CON 1340 Dyna Glide Low Rider Convertible GG 1994-1998  HARLEY DAVIDSON FXDWG 1340 Dyna Wide Glide GE 1993-1999  HARLEY DAVIDSON FXDX 1450 Dyna Super Glide Sport GJ 1999  HARLEY DAVIDSON FXE 1340 Super Glide 1984  HARLEY DAVIDSON FXEF 1340 Fat Bob BB 1984-1985  HARLEY DAVIDSON FXLR 1340 Low Rider Custom 1987-1994  HARLEY DAVIDSON FXLR 1340 Low Rider Custom EL 1991-1992  HARLEY DAVIDSON FXR 1340 Super Glide EA 1986-1994  HARLEY DAVIDSON FXRDG 1340 Disc Glide 1984  HARLEY DAVIDSON FXRS 1340 Low Glide 1984-1992  HARLEY DAVIDSON FXRS 1340 Low Rider Convertible EM 1989-1993  HARLEY DAVIDSON FXRS-SP 1340 Low Rider Special Edtion EG 1986-1993  HARLEY DAVIDSON FXRT 1340 Sport Glide EC 1984-1992  HARLEY DAVIDSON FXS 1340 Low Rider 1984  HARLEY DAVIDSON FXSB 1340 Low Rider 1984  HARLEY DAVIDSON FXSB 1340 Low Rider BF 1985       Oferowany produkt jest fabrycznie nowy! DOTYCZY 1 KOMPLETU KLOCKÓW HAMULCOWYCH NA 1 TARCZĘ HAMULCOWĄ (w 1 komplecie są 2 klocki) Prosimy o informację dotyczącą formy płatności. Na sprzedany towar zostanie wystawiony paragon lub faktura VAT JEŻELI KUPUJESZ KILKA PRZEDMIOTÓW TO WYSYŁAMY JEDNĄ PACZKĄ. W OFERCIE POSIADAMY KLOCKI HAMULCOWE DO INNYCH MAREK I MODELI MOTOCYKLI OLEJE SILNIKOWE, FILTRY OLEJU, FILTRY POWIETRZA, USZCZELKI, ZESTAWY NAPRAWCZE, OPONY, DĘTKI.. Więcej informacji na naszej witrynie internetowej e-motocykl.com ",Sie 2018,20 Maj 14:17,https://sprzedajemy.pl/skrzynia-biegow-20dp35-fiat-peugeot-citroen-1-6-regeneracja-ryki-2-6bea9f-nr67631548
SAAB 9-5 lampa tył prawa lewa combi sedn hatback, SAAB 9-5 lampa tył cena 30zl sztuka Kielce telefon 517--965--401 ,Mar 2022,20 Maj 14:15,https://sprzedajemy.pl/skrzynia-biegow-20dp35-fiat-peugeot-citroen-1-6-regeneracja-ryki-2-6bea9f-nr67631548
duży talerz-Imari," vintage duży talerz dekoracyjny-Imari,wzór orientalny,kwiatowy,złote akcenty,krawędz złocona drobnymi kwiatuszkami,sygnowany,lata 80-te,śr.27cm.,stan widoczny na zdjęciach-50zł/wysyłka pocztą/ ",Wrz 2016,20 Maj 14:28,https://sprzedajemy.pl/skrzynia-biegow-20dp35-fiat-peugeot-citroen-1-6-regeneracja-ryki-2-6bea9f-nr67631548
Silnik HPA konwersja Polarstar V2 F2 M4," Nowy silnik Polarstar V2 do konwersji replik m4/m16 + wszystko co producent oryginalnie daje w zestawie. Nie wysyłam, odbiór tylko w Poznaniu ",Sty 2018,20 Maj 14:27,https://sprzedajemy.pl/skrzynia-biegow-20dp35-fiat-peugeot-citroen-1-6-regeneracja-ryki-2-6bea9f-nr67631548
"motoreduktor / przekładnia 0,37kW 90obr. 3fazowy SEW"," motoreduktor trójfazowy 0,37kW 90obr. SEW (po remoncie, gotowy do pracy) średnica wału: 25mm waga: 19kg wystawiamy faktury VAT cena BRUTTO miesięczna GWARANCJA rozruchowa  wysyłka kurierem: przelew: 17,5zł pobranie: 20zł więcej motoreduktorów znajdziesz w naszych ogłoszeniach ",Mar 2018,20 Maj 14:26,https://sprzedajemy.pl/skrzynia-biegow-20dp35-fiat-peugeot-citroen-1-6-regeneracja-ryki-2-6bea9f-nr67631548
"VOLVO V40 S40 1,8 16V 2,0 16V pompa wspomagania"," VOLVO V40 S40 1,8 16V 2,0 16V pompa wspomagania cena 30zl Kielce telefon 517--965--401 ",Mar 2022,20 Maj 14:15,https://sprzedajemy.pl/skrzynia-biegow-20dp35-fiat-peugeot-citroen-1-6-regeneracja-ryki-2-6bea9f-nr67631548
"Mitsubishi carisma 1,8 zacisk jarzmo przód"," MITSUBISHI Carisma 1,8 zacisk jarzmo cena 50zl Kielce telefon 517 965 401 ",Mar 2022,20 Maj 14:14,https://sprzedajemy.pl/skrzynia-biegow-20dp35-fiat-peugeot-citroen-1-6-regeneracja-ryki-2-6bea9f-nr67631548
Jazz LP; Wallace Davenport-Angi Domdey," MUZA SX 1529, 1976 R. BDB. .Pytania na meila. ",Wrz 2018,20 Maj 14:37,https://sprzedajemy.pl/skrzynia-biegow-20dp35-fiat-peugeot-citroen-1-6-regeneracja-ryki-2-6bea9f-nr67631548
Citroën C5 X7," Sprzedam Citroën c5 2010 r. 1.6 hdi 110km Samochód w środku zadbany, oszczędny dynamiczny silnik jak na swoje gabaryty, zwykłe zawiesznie nie hydro mimo tego auto bardzo wygodne i dobrze się prowadzi. Spalanie w cyklu mieszanym poniżej 6L, w trasie da się zejść poniżej 5. Przegląd do 05.10.2023 a ubezpieczenia do 18.08.2023. Książka serwisowa. Z wyposażenia: - swiatla do jazdy dziennej - Bluetooth z możliwością wykonywania połączeń - czujniki parkowania z przodu i z tyłu - multifunkcyjna kierownica - hak wbity w dowód - regulacja podparcia odcinka lędźwiowego - aux i USB - automatyczne wycieraczki - wentylowany schowek - lusterka składane elektrycznie - 4 szyby w prądzie - doświetlanie zakrętów - klimatyzacja dwustrefowa - podłokietnik przód i tył - tempomat - lusterka ustawiane elektrycznie - isofix - aluminiowe felgi ",Maj 2018,20 Maj 14:22,https://sprzedajemy.pl/skrzynia-biegow-20dp35-fiat-peugeot-citroen-1-6-regeneracja-ryki-2-6bea9f-nr67631548
Podręcznik Książka do Liceum / Technikum Biologia," Witam. Posiadam na sprzedaż Podręcznik Biologia Operon do klasy Pierwszej. Książka w bardzo dobrym stanie, nie zniszczona, a zadbana. Każdemu uczniowi klasy pierwszej szkoły średniej ta książka jest niezbędna do nauki. Zapraszam do obejrzenia pozostałych ogłoszeń oraz napisania na Priv. Pozdrawiam Serdecznie! (Cena do negocjacji) ",Maj 2018,20 Maj 14:34,https://sprzedajemy.pl/skrzynia-biegow-20dp35-fiat-peugeot-citroen-1-6-regeneracja-ryki-2-6bea9f-nr67631548
Przyrząd tzw.piesek do ściągania oficerek, Stary przyrząd tzw.piesek do ściągania oficerek długość 33 cm cena nie zawiera kosztów przesyłki ,Mar 2019,20 Maj 14:22,https://sprzedajemy.pl/skrzynia-biegow-20dp35-fiat-peugeot-citroen-1-6-regeneracja-ryki-2-6bea9f-nr67631548
STANTEKS -producent odzieży sportowej szuka nowych odbiorców," Firma Stanteks jest producentem strojów kąpielowych , bielizny termoaktywnej oraz odzieży rowerowej. Serdecznie zapraszamy Państwa do współpracy. Katalog wszystkich naszych produktów można pobrać ze strony internetowej www.*********** Wszystkie nasze wyroby , wraz z występującymi rozmiarami i kolorami znajdują się również na naszej stronie internetowej. Dysponujemy zdjęciami oraz opisami naszych wyrobów w pięciu językach (polski , angielski , niemiecki , rosyjski , hiszpański) W 70% nasze wyroby są eksportowane do krajów zachodnich gdzie maja bardzo dobre opinie. Nasza Firma pragnie poszerzyć sprzedaż w Polsce , dlatego szukamy nowych odbiorców w tych miastach , w których do tej pory nie mamy swoich przedstawicieli. W razie dodatkowych pytań chętnie na nie odpowiem. www.*********** ",Sie 2017,20 Maj 14:41,https://sprzedajemy.pl/skrzynia-biegow-20dp35-fiat-peugeot-citroen-1-6-regeneracja-ryki-2-6bea9f-nr67631548
Skladanka LP. ; GREENPEACE - BREAKTHROUGH. --2 LP., MIELODIJA 1989 R. Doskonale odbior wysylka. Koszt wysylki; 1--3 LP= 15 zl. Pytania na meila. ,Wrz 2018,20 Maj 14:35,https://sprzedajemy.pl/skrzynia-biegow-20dp35-fiat-peugeot-citroen-1-6-regeneracja-ryki-2-6bea9f-nr67631548
"RENAULT 19 21 SAFRANE TRAFIC 1,7 pompa wspomagania"," RENAULT 19 21 SAFRANE TRAFIC 1,7 pompa wspomagania cena 50zl Kielce telefon 517--965--401 ",Mar 2022,20 Maj 14:15,https://sprzedajemy.pl/skrzynia-biegow-20dp35-fiat-peugeot-citroen-1-6-regeneracja-ryki-2-6bea9f-nr67631548
"VW Polo ibiza fabia 1,2 12V czujnik poziomu oleju"," VW Polo ibiza fabia 1,2 12v czujnik poziomu oleju cena 30zl Kielce telefon 517'''965'''401 ",Mar 2022,20 Maj 14:15,https://sprzedajemy.pl/skrzynia-biegow-20dp35-fiat-peugeot-citroen-1-6-regeneracja-ryki-2-6bea9f-nr67631548
"Instrukcja Nikon AF-S DX Zoom-Nikkor 18-70 f 3,5-4,5 G IF"," Witam serdecznie, Do sprzedania oferuję oryginalną instrukcję do obiektywu Nikon AF-S DX Zoom-Nikkor 18-70 f. 3.5-4.5 G IF. Instrukcja w formie klasycznej Nikonowskiej ""rozkładanki"". Papier offsetowy, matowy. Zawiera informacje na temat obsługi, kompatybilności z pomiarem światła w rozmaitych modelach aparatów Nikona oraz kompatybilności filtrów i akcesoriów. Tekst w językach: - japońskim - angielskim - niemieckim - francuskim - hiszpańskim - włoskim - koreańskim - chińskim STAN: Instrukcja używana ale w bardzo dobrym stanie zachowania - pozostała mi po dawno sprzedanym obiektywie. Może przyda się komuś do kompletu. PŁATNOŚĆ, ODBIÓR, WYSYŁKA: Zakup możliwy poprzez kontakt przez wiadomość prywatną, gdzie sprzedający i kupujący uzgodnią warunki transakcji. Możliwy (i mile widziany) odbiór osobisty w Starej Wsi koło Brzozowa (woj. podkarpackie). Wysyłka możliwa po wcześniejszej przedpłacie na konto bankowe. Koszt wysyłki listem poleconym: - ekonomicznym: 8 zł - priorytetowym: 10 zł Nie wysyłam za pobraniem ani paczkomatami. Serdecznie zapraszam do zakupu oraz przejrzenia pozostałych moich ogłoszeń (gdzie można znaleźć więcej albumów, książek, czasopism i katalogów fotograficznych). ",Mar 2021,20 Maj 14:26,https://sprzedajemy.pl/skrzynia-biegow-20dp35-fiat-peugeot-citroen-1-6-regeneracja-ryki-2-6bea9f-nr67631548
Koła letnie AVUS 4x100 R14 + NOWE OPONY Kleber 185/60," Do sprzedania posiadam komplet pięknych alufelg AVUS SNOWFLAKE o rozstawie śrub 4x100, w rozmiarze 14"", ET 38, szerokość felgi 6J, otwór centrujący 57,1 mm z fabrycznie NOWYMI oponami Kleber Dynaxer HP3 w rozmiarze 185/60 R14, DOT 1018/1118. Felgi profesjonalnie odnowione, po renowacji nie zakładane na samochód, opony również nigdy nie jeżdżone, posiadają jeszcze gwarancję. Całość wyważona, gotowa do założenia.  Cena do negocjacji.  Preferuję odbiór osobisty. ",Wrz 2015,20 Maj 14:23,https://sprzedajemy.pl/skrzynia-biegow-20dp35-fiat-peugeot-citroen-1-6-regeneracja-ryki-2-6bea9f-nr67631548
VW GOLF II lampa tył lewa, VW GOLF II lampa tyl lewa cena 40zl KIELCE Telefon 517--965--401 ,Mar 2022,20 Maj 14:15,https://sprzedajemy.pl/skrzynia-biegow-20dp35-fiat-peugeot-citroen-1-6-regeneracja-ryki-2-6bea9f-nr67631548
RENAULT MEGANE I HB lampa tył prawa lewa, RENAULT MEGANE I HB lampa tył cena 25zl sztuka KIELCE TEELFON 517--965--401 ,Mar 2022,20 Maj 14:15,https://sprzedajemy.pl/skrzynia-biegow-20dp35-fiat-peugeot-citroen-1-6-regeneracja-ryki-2-6bea9f-nr67631548
okazja orginał szyby   FIAT  125 p," szyby: przód klejona, tył ogrzewana ,używane w dobrym stanie , nie znam daty produkcji auta możliwość negocjacji ceny oczekuję ile ktoś da ",Kwi 2018,20 Maj 14:22,https://sprzedajemy.pl/skrzynia-biegow-20dp35-fiat-peugeot-citroen-1-6-regeneracja-ryki-2-6bea9f-nr67631548
Do łazienki i nie tylko każdy wymiar kolor," Dzien dobry. Oferuję Panstwu wykonanie mebli ze zdjęć i nie tylko , kolor ,rodzaj i wymiar dowolny. Proszę dzwonić 5 0 6 1 3 3 8 6 8 Janusz Toruń Mickiewicza 61 ",Maj 2016,20 Maj 14:42,https://sprzedajemy.pl/skrzynia-biegow-20dp35-fiat-peugeot-citroen-1-6-regeneracja-ryki-2-6bea9f-nr67631548
"koła Bmw E46 E36 komplet felgi stalowe 15"" opony kołpaki"," Sprzedam komplet kół od BMW E46, z kołpakami. Felgi stalowe: -Oryginalne BMW, Producent felg BMW OE -rozmiar 15"", -rozstaw śrub 5x120 -61/2Jx15H2 1S42 Opony: -Goodyear Excellence 195/65 R15, -ok 4 mm bieżnika. -data produkcji na oponach 0912 Oryginalne kołpaki BMW, w bardzo dobrym stanie, bez rys czy zadrapań. Możliwość sprzedaży osobno felg lub kołpaków. Zapraszam do kontaktu pod numerem telefonu. ",Lip 2018,20 Maj 14:41,https://sprzedajemy.pl/skrzynia-biegow-20dp35-fiat-peugeot-citroen-1-6-regeneracja-ryki-2-6bea9f-nr67631548
Sukienka okazyjna 38," Sprzedam w rewelacyjnym stanie sukienkę okazyjną w rozmiarze 38. Na ramiączkach, wiązana z tyłu, seksowna! Podaję wymiary Biust 80 cm Talia 74 cm Długość całkowita z ramiączkami 101 cm ",Wrz 2022,20 Maj 14:40,https://sprzedajemy.pl/skrzynia-biegow-20dp35-fiat-peugeot-citroen-1-6-regeneracja-ryki-2-6bea9f-nr67631548
Skrzynia Biegów TGV VW PASSAT B8 2.0 TDI Regeneracja, Oferta dotyczy w pełni zregenerowanej Skrzyni Biegów TGV Pasująca do aut: -VW Passat B8 Pojemność silnika: 2.0 TDI Ilość biegów: 6 Każda skrzynia biegów przed wyjazdem jest sprawdzona na hamowni pod kontem: -generowanych hałasów -działania biegów -synchronizatorów -szczelności układu Podana cena obejmuje przy zwrocie zużytej skrzyni biegów. Jeżeli nie znaleźli Państwo skrzyni biegów która Was interesuje prosimy o kontakt. Po podaniu 17 znakowego numeru VIN dobierzemy odpowiednią skrzynie. Oferujemy także regenerację Państwa skrzyni biegów. GWARANCJA 12 MIESIĘCY !!! Faktura VAT !!! ,Lip 2020,20 Maj 14:36,https://sprzedajemy.pl/skrzynia-biegow-20dp35-fiat-peugeot-citroen-1-6-regeneracja-ryki-2-6bea9f-nr67631548
Main 40-MT10B2-MAC2HG do 32FU5253, Sprawna 100% ,Maj 2017,20 Maj 14:32,https://sprzedajemy.pl/skrzynia-biegow-20dp35-fiat-peugeot-citroen-1-6-regeneracja-ryki-2-6bea9f-nr67631548
"120 letnia biblioteka na wymiar,kolor,rodzaj  wg życzenia"," Dzien dobry, oferuję Panstwu wykonanie mebli ze zdjęć i podobnych na dowolny wymiar,kolor i rodzaj zgodnie z zyczeniem klijenta . Proszę dzwonić ********* Meble wykonywane na wymiar, kolor dowolny , rodzaj i wymiar, mogę wykonać surowe do malowania Pozdrawiam ********* ",Maj 2016,20 Maj 14:42,https://sprzedajemy.pl/skrzynia-biegow-20dp35-fiat-peugeot-citroen-1-6-regeneracja-ryki-2-6bea9f-nr67631548
Moduł podczerwieni IR do LG 55UK6750PLD i 49UJ6517 EBR, Przy wpłacie przesyłka 15 zł ,Maj 2017,20 Maj 14:31,https://sprzedajemy.pl/skrzynia-biegow-20dp35-fiat-peugeot-citroen-1-6-regeneracja-ryki-2-6bea9f-nr67631548
Venezia 100% bawełna krotka koszula bluzka," Koszula bluzka Venezia Krotka, swobodna, Pasuje na M L Kolor bezowy. 100% bawełna. ",Maj 2020,20 Maj 14:23,https://sprzedajemy.pl/skrzynia-biegow-20dp35-fiat-peugeot-citroen-1-6-regeneracja-ryki-2-6bea9f-nr67631548
