title,desc,user_registered,offer_posted,url
Żuk rozrusznik, Sprzedam rozrusznik do żuka s21. Możliwa wysyłka ,Kwi 2016,20 Maj 14:12,https://sprzedajemy.pl/skrzynia-biegow-20dp35-fiat-peugeot-citroen-1-6-regeneracja-ryki-2-6bea9f-nr67631548
Japan Water Line Serie 1:700 6 modeli okrętów do sklejania," Japan Navy Submarine I-370 / I-68 1:700 Hasegawa 00432 Modele 2 okrętów podwodnych wykonano w skali 1/700. Modele z serii Water Line - oznacza to, że okręty można ustawić na płaskiej powierzchni bez konieczności stosowania podstawki (okręty wymodelowane powyżej wodnicy). Dane techniczne  I-370  I-68 Długość modelu  105mm 147mm Cena modelu: 32zł Cena nie obejmuje kosztów wysyłki Japanese Military Transport Set 1:700 Tamiya 77089 Modele 2 okrętów transportowo-desantowych wykonano w skali 1/700. Modele z serii Water Line - oznacza to, że okręty można ustawić na płaskiej powierzchni bez konieczności stosowania podstawki (okręty wymodelowane powyżej wodnicy). Na wierzchu kartonu oprócz dwóch okrętów widoczne są dodatkowe małe jednostki Pływające, które stanowią jedynie wizualizcję całości. Plastikowy model do sklejenia i pomalowania. W modelu brak kleju, pędzelków i farb. Dane techniczne Typ SBT  Typ LCT Długość modelu 118mm  138mm Szerokość  14mm   16mm Wysokość  23mm   25mm Cena modelu: 38zł Cena nie obejmuje kosztów wysyłki Japanese Light Cruiser Yahagi 1:700 Tamiya 77063 Model japońskiego lekkiego krążownika Yahagi wykonany w skali 1:700 Modele z serii Water Line - oznacza to, że okręty można ustawić na płaskiej powierzchni bez konieczności stosowania podstawki (okręty wymodelowane powyżej wodnicy). Plastikowy model do sklejenia i pomalowania, z kalkomanią flag. W modelu brak kleju, pędzli i farb. Dane techniczne  YAHAGI Długość modelu  247mm  Cena modelu: 65zł Cena nie obejmuje kosztów wysyłki Hikawamaru Spwcial Hospital Ship 1:700 Hasegawa 43090 Model japońskiego okrętu szpitala z okresu II Wojny Światowej wykonany w skali 1:700. Modele z serii Water Line - oznacza to, że okręty można ustawić na płaskiej powierzchni bez konieczności stosowania podstawki (okręty wymodelowane powyżej wodnicy). Plastikowy model do sklejenia i pomalowania, z kalkomanią. W modelu brak kleju, pędzelków i farb. Dane techniczne  HIKAWAMARU Długość modelu  235mm    Cena modelu: 40zł Cena nie obejmuje kosztów wysyłki W przypadku zakupu całości przedstawionej oferty cena wynosi 165zł, bez kosztów wysyłki. ",Lip 2019,20 Maj 14:22,https://sprzedajemy.pl/skrzynia-biegow-20dp35-fiat-peugeot-citroen-1-6-regeneracja-ryki-2-6bea9f-nr67631548
"hyundai coupe 2,0 1,6v przepustnica"," hyundai coupe 2,0 16v przepustnica cena 30zl Kielce telefon 517 965 401 ",Mar 2022,20 Maj 14:14,https://sprzedajemy.pl/skrzynia-biegow-20dp35-fiat-peugeot-citroen-1-6-regeneracja-ryki-2-6bea9f-nr67631548
Gałka mieszek zmiany biegów citroen c5, Cześć sprawna Możliwa wysyłka ,Paź 2020,20 Maj 14:15,https://sprzedajemy.pl/skrzynia-biegow-20dp35-fiat-peugeot-citroen-1-6-regeneracja-ryki-2-6bea9f-nr67631548
ALFA ROMEO 146 lampa przód prawa, ALFA ROMEO 146 lampa przód prawa cena 40zl Kielce telefon 517--965--401 ,Mar 2022,20 Maj 14:15,https://sprzedajemy.pl/skrzynia-biegow-20dp35-fiat-peugeot-citroen-1-6-regeneracja-ryki-2-6bea9f-nr67631548
"hyundai getz 1,1 listwa wtryskowa wtrysk wtryski"," HYUNDAI Getz 1,1 listwa wtryskowa z wtryskami cena 50zl komplet Kielce telefon 517 965 401 ",Mar 2022,20 Maj 14:14,https://sprzedajemy.pl/skrzynia-biegow-20dp35-fiat-peugeot-citroen-1-6-regeneracja-ryki-2-6bea9f-nr67631548
Łużko Stelaż Elektryczny 100x200," Witam sprzedam używany stelaż wkład elektryczny do łóżka dla osoby niepełnosprawnej 100x200, pilot ma 3 funkcje podnoszenia głowy, nóg, lub obie funkcje na raz, sprzęt w bardzo dobrym stanie używany ok, 2 miesięcy, cena do malutkiej negocjacji, więcej pod podanym nr.tel. ",Mar 2016,20 Maj 14:17,https://sprzedajemy.pl/skrzynia-biegow-20dp35-fiat-peugeot-citroen-1-6-regeneracja-ryki-2-6bea9f-nr67631548
Mieszkanie Warszawa 49.3m2," Na sprzedaż luksusowy, 3-pokojowy apartament o pow. 49,3 m2 zlokalizowany na 20 piętrze w jednej z wież kompleksu Platinum Towers przy ul. Grzybowskiej. Budynek monitorowany i chroniony, z całodobową recepcją. Apartament wykończony, w stanie do wprowadzenia. Pomieszczenia: salon z aneksem kuchennym, 2 sypialnie, łazienka (wanna, wc), przedpokój. ​W pobliżu liczne sklepy i restauracje, w odległości 1,5 km CH Złote Tarasy oraz Pałac Kultury i Nauki. W promieniu 3 km rynek Starego Miasta i Teatr Wielki. Świetna komunikacja: autobus, tramwaj, metro (Rondo ONZ 700 m). Cena mieszkania 1 200 000 PLN + miejsce parkingowe w garażu podziemnym w cenie 50 000 PLN. Dane kontaktowe do agenta: Barbara Lorek Tel: ***-***-*** E-mail: **@p*******.pl ___________ Luxurious 3-room apartment with floor area: 49,3 sq.m located on the 20th floor in one of the towers of the Platinum Towers complex at Grzybowska Street (Wola district). The building is equipped with a 24-hour reception, monitoring and guard systems. The apartment is finished, ready to move in. Premises consists of: living room with kitchenette, 2 bedroom, bathroom (bathtub, toilet), hall. Nearby there are numerous shops and restaurants, 1.5 km Złote Tarasy Shopping Centre and Palace of Culture and Science. Within a radius of 3 km, the Old Town Square, the Grand Theater. Great communication: bus, tram, metro (Rondo ONZ 700 m). Price: PLN 1,200,000 + parking space in the underground garage for PLN 50,000. For service in English call Wojciech Rusin at +48 692 016 094. ::LINK DO STRONY http****************************************** ::KONTAKT DO AGENTA Barbara Lorek +48 22 100 57 00 +48 *** *** *** **@p*******.pl -------------------------- Biuro nieruchomości PROPERCO współpracuje z doświadczonymi specjalistami finansowymi, oferującymi sprawdzenie zdolności kredytowej oraz przedstawienie oferty finansowania nieruchomości / Informacje dotyczące opisu nieruchomości podane są przez właściciela, mają charakter wyłącznie informacyjny i mogą podlegać aktualizacji. Oferta dotycząca nieruchomości nie stanowi oferty określonej w art. 66 i następnych KC. Zapraszamy do siedziby naszego biura w Warszawie przy ul. Brylowskiej 2 lok. 3B (Wola, Czyste). Dane adresowe: PROPERCO sp. z o.o. sp.k ul. Brylowska 2 lok. 3B 01-216 Warszawa http******************** ",Sie 2013,20 Maj 14:16,https://sprzedajemy.pl/skrzynia-biegow-20dp35-fiat-peugeot-citroen-1-6-regeneracja-ryki-2-6bea9f-nr67631548
CHEVROLET AVEO lampa przód lewa, CHEVROLET AVEO lampa przód lewa cena 50zl Kielce telefon 517---965--401 ,Mar 2022,20 Maj 14:15,https://sprzedajemy.pl/skrzynia-biegow-20dp35-fiat-peugeot-citroen-1-6-regeneracja-ryki-2-6bea9f-nr67631548
"Świece do usuwania woskowiny, czyszczenia i pielęgnacji ucha"," Świece do usuwania woskowiny, dynamicznego czyszczenia i pielęgnacji ucha. Termo-uszna terapia. Pomaga w leczeniu zawrotów głowy, niedrożności nosa, uszkodzeń, utraty pamięci, niestabilności emocjonalnej, zaburzeń nerwowych wewnątrzczaszkowych, nerwów twarzy, nerwów gardłowych, zapalenia gardła i innych części zabiegu. Stosowana w wewnątrzczaszkowej pętli termicznej, zwiększa energię tlenu i krążenie krwi. Łagodzi dolegliwości układu oddechowego, chorób płuc, astmy, kataru i alergii. BEZ OLEJKÓW, BEZ CHEMICZNYCH DODATKÓW I BEZ BARWNIKÓW. SAMA NATURA - CZYSTE PŁÓTNO I WOSK PSZCZELI Długość 20 cm FOTO REAL - CENA DOTYCZY 1 szt. ",Mar 2014,20 Maj 14:21,https://sprzedajemy.pl/skrzynia-biegow-20dp35-fiat-peugeot-citroen-1-6-regeneracja-ryki-2-6bea9f-nr67631548
Skrzynia Biegów MHK Audi A4 B8 S4 B8 A5 S5 Regeneracja," Witamy na naszej aukcji Skrzynia Biegów MHK Pasująca do Aut -Audi A4 B8 S4 A5 S5 Ilość biegów 6 Pojemność silnika 2.0 TDI Każda skrzynia biegów przed wyjazdem jest sprawdzona na hamowni pod kątem: generowanych hałasów działania biegów synchronizatorów szczelności układu Warunkiem zakupu oraz Gwarancji jest zwrot zużytej skrzyni biegów. Wystawiamy Dowód Zakupu Udzielamy pisemnej 12 miesięcy gwarancji Jeżeli nie znaleźli Państwo skrzyni biegów, która Was interesuje prosimy o kontakt. Prosimy podać numer VIN w celu dobrania odpowiedniej skrzyni biegów. Oferujemy także regenerację Państwa skrzyni biegów. ",Lip 2020,20 Maj 14:14,https://sprzedajemy.pl/skrzynia-biegow-20dp35-fiat-peugeot-citroen-1-6-regeneracja-ryki-2-6bea9f-nr67631548
BMW E46 sedan lampa tył lewa, BMW E46 Sedan lampa tyl lewa cena 25zl Kielce telefon 517--965--401 ,Mar 2022,20 Maj 14:14,https://sprzedajemy.pl/skrzynia-biegow-20dp35-fiat-peugeot-citroen-1-6-regeneracja-ryki-2-6bea9f-nr67631548
Czujnik Serwa Ford DE932C444BA 5229485 BRATFORD RADOM, Części do Forda Bratford Radom ,Sty 2022,20 Maj 14:35,https://sprzedajemy.pl/skrzynia-biegow-20dp35-fiat-peugeot-citroen-1-6-regeneracja-ryki-2-6bea9f-nr67631548
syrena 105 bosto r20 104 usta atrapa grill, Syrena 104 bosro r20 105 usta atrapa cena 250zl Kielce telefon 517 965 401 ,Mar 2022,20 Maj 14:15,https://sprzedajemy.pl/skrzynia-biegow-20dp35-fiat-peugeot-citroen-1-6-regeneracja-ryki-2-6bea9f-nr67631548
Krzesło Obrotowe Niebieskie Skalberg Sporren Ikea Lublin," Jeśli czytasz to ogłoszenie znaczy to, że jest AKTUALNE. Krzesło Obrotowe Niebieskie Skalberg Sporren Ikea Lublin Czuby Sprzedam Krzesło Obrotowe Niebieskie Skalberg Sporren Ikea. Krzesło posiada normalne ślady użytkowania, jest w bardzo dobrym stanie. Cena ostateczna, bez negocjacji, nie wysyłam, nie zamieniam. Na sms/czat nie odpisuje, nie sprawdzam. Kontakt telefoniczny 10-20. Tylko odbiór osobisty – Lublin Czuby. ",Wrz 2017,20 Maj 14:33,https://sprzedajemy.pl/skrzynia-biegow-20dp35-fiat-peugeot-citroen-1-6-regeneracja-ryki-2-6bea9f-nr67631548
grabki zagarniacze do siewnika poznaniak wysyłka czesci, witam posiadam w sprzedaży różne typy zagarniaczy do siewnika poznaniak jak i innych siewników na zamowienie. ,Paź 2016,20 Maj 14:38,https://sprzedajemy.pl/skrzynia-biegow-20dp35-fiat-peugeot-citroen-1-6-regeneracja-ryki-2-6bea9f-nr67631548
Wózek Dziecięcy Graco Evo Khaki Spacerówka/Głęboki Lublin," Jeśli czytasz to ogłoszenie znaczy to, że jest AKTUALNE. Wózek Dziecięcy Graco Evo Khaki Spacerówka/Głęboki Lublin Czuby Sprzedam Wózek Dziecięcy Graco Evo Khaki Spacerówka/Głęboki - wózek wielofunkcyjny. Wózek posiada normalne ślady użytkowania, jest w bardzo dobrym stanie, używany bardzo krótko i stosunkowo rzadko. Lekko pogryziony pałąk, kupiona osłona/ochraniacz firmy Camicco. Cena ostateczna, bez negocjacji, nie wysyłam, nie zamieniam. Na sms/czat nie odpisuje, nie sprawdzam. Kontakt telefoniczny 10-20. Tylko odbiór osobisty – Lublin Czuby. ",Wrz 2017,20 Maj 14:33,https://sprzedajemy.pl/skrzynia-biegow-20dp35-fiat-peugeot-citroen-1-6-regeneracja-ryki-2-6bea9f-nr67631548
Fajne szare klapeczki bogato zdobione VICES," Sprzedam nowe i wygodne klapeczki na płaskim obcasie firmy ""VICES"" w roz. 36 Buciki świetnie nadają się na codzień!!!  Stan określam jako IDEALNY!!! NOWE!!! Przesyłka 18 zł paczkomat ",Sty 2013,20 Maj 14:15,https://sprzedajemy.pl/skrzynia-biegow-20dp35-fiat-peugeot-citroen-1-6-regeneracja-ryki-2-6bea9f-nr67631548
Frezowanie CNC elementy meble fronty meblowe na wymiar," Chętnie zrealizujemy wszelkie zamówienia na frezowanie, cięcie i grawerowanie CNC. Frezujemy fronty meblowe oraz ozdobne panele ścienne. Wycinamy także inne elementy mebli zgodnie z projektem. Wycinamy, frezujemy oraz grawerujemy, przy użyciu nowoczesnego plotera CNC (pole robocze 2600x1400mm) w następujących materiałach: - Sklejka drewniana - Drewno lite i klejone - MDF, - HPL - PCV i PVC, - plexi - akryl - dibond oraz innych tworzywach sztucznych i materiałach drewnopochodnych. Zapraszamy do współpracy osoby prywatne oraz firmy, możliwość wystawienia faktury VAT. Zamówione produkty wysyłamy kurierem, oczywiście jest też możliwość odbioru osobistego. ",Maj 2023,20 Maj 14:16,https://sprzedajemy.pl/skrzynia-biegow-20dp35-fiat-peugeot-citroen-1-6-regeneracja-ryki-2-6bea9f-nr67631548
Meble wg projektu na wymiar cięcie CNC drewno sklejka płyta," Chętnie zrealizujemy wszelkie zamówienia na frezowanie, cięcie i grawerowanie CNC. Frezujemy fronty meblowe oraz ozdobne panele ścienne. Wycinamy także inne elementy mebli zgodnie z projektem. Wycinamy, frezujemy oraz grawerujemy, przy użyciu nowoczesnego plotera CNC (pole robocze 2600x1400mm) w następujących materiałach: - Sklejka drewniana - Drewno lite i klejone - MDF, - HPL - PCV i PVC, - plexi - akryl - dibond oraz innych tworzywach sztucznych i materiałach drewnopochodnych. Zapraszamy do współpracy osoby prywatne oraz firmy, możliwość wystawienia faktury VAT. Zamówione produkty wysyłamy kurierem, oczywiście jest też możliwość odbioru osobistego. ",Maj 2023,20 Maj 14:31,https://sprzedajemy.pl/skrzynia-biegow-20dp35-fiat-peugeot-citroen-1-6-regeneracja-ryki-2-6bea9f-nr67631548
"Opel corsa D felga 1,4 cali felgi ET39", OPEL Corsa D felgi 14cali ET39 cena 80zl sztuka Kielce telefon 517'''965'''401 ,Mar 2022,20 Maj 14:15,https://sprzedajemy.pl/skrzynia-biegow-20dp35-fiat-peugeot-citroen-1-6-regeneracja-ryki-2-6bea9f-nr67631548
"MERCEDES Vito 639 Viano 2,2cdi mapsensor rura dolot powietrz"," Mercedes Vito 639 Viano 2,2cdi mapsensor rura dolot powietrza cena 50zl Kielce telefon 517---965---401 ",Mar 2022,20 Maj 14:14,https://sprzedajemy.pl/skrzynia-biegow-20dp35-fiat-peugeot-citroen-1-6-regeneracja-ryki-2-6bea9f-nr67631548
Domki na zgłoszenie, Domki drewniane 5x7 z tarasem a u góry poddasze antresola 5x5 pokryty gontem okna plastikowe drzwi zewnętrzne kolor stolarki biały lub brązowe w cenie montaż. ,Lip 2011,20 Maj 14:18,https://sprzedajemy.pl/skrzynia-biegow-20dp35-fiat-peugeot-citroen-1-6-regeneracja-ryki-2-6bea9f-nr67631548
RENAULT Laguna II airbag poduszka pasażera, Renault Laguna II poduszka pasażera cena 30zl Kielce telefon 517..965..401 ,Mar 2022,20 Maj 14:14,https://sprzedajemy.pl/skrzynia-biegow-20dp35-fiat-peugeot-citroen-1-6-regeneracja-ryki-2-6bea9f-nr67631548
Uchwyt raczka od podsufitki bmw e38 x5 wysylka, Uchwyt do podsufitki Mozliwa wysylka W razie pytan prosze o kontakt ,Lis 2016,20 Maj 14:33,https://sprzedajemy.pl/skrzynia-biegow-20dp35-fiat-peugeot-citroen-1-6-regeneracja-ryki-2-6bea9f-nr67631548
Klamka sprzęgla Jawa aluminiowa, Witam mam do sprzedania widoczną na zdjęciach oryginalną klamkę sprzęgla motoru Jawa aluminiowa. Zachęcam do kupna I pozostałych aukcji ,Sty 2017,20 Maj 14:43,https://sprzedajemy.pl/skrzynia-biegow-20dp35-fiat-peugeot-citroen-1-6-regeneracja-ryki-2-6bea9f-nr67631548
Rzutnik slajdów Braun Paximat S Electric," Sprzedam rzutnik do slajdów BRAUN Paximat S-Electric. Stary zabytkowy rzutnik wyprodukowany w  Niemczech. Jest to kompletny zestaw: -rzutnik -walizka do przechowywania - przewód zasilający - przewód z pilotem sterującym zmianą slajdów, oraz sterujący ostrością. Rzutnik wstępnie sprawdzony: - działa wentylator - działa żarówka - reaguje zdalne przewijanie slajdów na pilota ( nie mam slajdów ) Rzutnik nie czyszczony, nie rozbierany. Stan kolekcjonerski. Doskonały okaz dla kolekcjonerów,  lub dla nadania wnętrzom stylu VINTAGE. Zapraszam do kupna. ",Wrz 2011,20 Maj 14:41,https://sprzedajemy.pl/skrzynia-biegow-20dp35-fiat-peugeot-citroen-1-6-regeneracja-ryki-2-6bea9f-nr67631548
Audi a8 d2 łapa silnika mozliwa wysyłka, Łapa silnika Audi Mozliw wysylka W razie pytan prosze o kontakt ,Lis 2016,20 Maj 14:31,https://sprzedajemy.pl/skrzynia-biegow-20dp35-fiat-peugeot-citroen-1-6-regeneracja-ryki-2-6bea9f-nr67631548
"Plyta . LP, skladanka ; EUROPA--HITPASADE 39."," EUROPA , BDB. Odbior wysylka. ",Wrz 2018,20 Maj 14:35,https://sprzedajemy.pl/skrzynia-biegow-20dp35-fiat-peugeot-citroen-1-6-regeneracja-ryki-2-6bea9f-nr67631548
Seat alhambra na sprzedaż, Sprzedam raczej w całości seat alhambra 2007 rok 2.0 tdi sześciobiegowa skrzynia biegów. Auto tak jak widać uszkodzone ,Maj 2023,20 Maj 14:35,https://sprzedajemy.pl/skrzynia-biegow-20dp35-fiat-peugeot-citroen-1-6-regeneracja-ryki-2-6bea9f-nr67631548
TAŚMA  LVDS SONY 1-849-268-11 do KDL32WD6000, Jak nowa ,Maj 2017,20 Maj 14:31,https://sprzedajemy.pl/skrzynia-biegow-20dp35-fiat-peugeot-citroen-1-6-regeneracja-ryki-2-6bea9f-nr67631548
Siano," Sprzedam siano - zbiór 2022, ok 250 szt. Jedlnia koło Pionek. Cena 5 szt. ",Wrz 2016,20 Maj 14:26,https://sprzedajemy.pl/skrzynia-biegow-20dp35-fiat-peugeot-citroen-1-6-regeneracja-ryki-2-6bea9f-nr67631548
Kamerka internetowa, Nowa kamerka internetowa - USB ,Mar 2014,20 Maj 14:21,https://sprzedajemy.pl/skrzynia-biegow-20dp35-fiat-peugeot-citroen-1-6-regeneracja-ryki-2-6bea9f-nr67631548
Kia K2700 K2500 poduszka silnika skrzyni biegów," KIA K2700 K2500 poduszka cena 50zl szt, KIELCE TELEFON 517..965..401 ",Mar 2022,20 Maj 14:15,https://sprzedajemy.pl/skrzynia-biegow-20dp35-fiat-peugeot-citroen-1-6-regeneracja-ryki-2-6bea9f-nr67631548
Plyta Skladanka LP. ; THE PREMIERE COLLECTION--MUSICALE., REALLY USEFULL 1988 R. BDB. Odbior wysylka. ,Wrz 2018,20 Maj 14:35,https://sprzedajemy.pl/skrzynia-biegow-20dp35-fiat-peugeot-citroen-1-6-regeneracja-ryki-2-6bea9f-nr67631548
"MAZDA 626 Comprex 2,0td kolektor wydechowy"," MAZDA 626 COMPREX 2,0td kolektor wydechowy cena 50zl Kielce telefon 517--965--401 ",Mar 2022,20 Maj 14:15,https://sprzedajemy.pl/skrzynia-biegow-20dp35-fiat-peugeot-citroen-1-6-regeneracja-ryki-2-6bea9f-nr67631548
skoda S100 1000MB 100S 105 osłona rozrządu smok obudowa, skoda s100 1000mb 105 110 100s obudowa osłona rozrzadu ze smokiem cena 150zl Kielce telefon 517 965 401 ,Mar 2022,20 Maj 14:14,https://sprzedajemy.pl/skrzynia-biegow-20dp35-fiat-peugeot-citroen-1-6-regeneracja-ryki-2-6bea9f-nr67631548
"Małpka kapucynka, małpa kapucynka, Cebus apella, oswojone"," Witam serdecznie. Do zaoferowania mamy młode małpki z bardzo dobrej, zaprzyjaźnionej hodowli z którą współpracujemy już wiele lat (nazwa łacińska: Cebus apella (Sapajus apella), nazwa PL: Kapucynka czubata) - odkarmiane ręcznie - w pełni oswojone, przyzwyczajone do człowieka. Oferowane maluszki są w wieku od 4 do 10 miesięcy. Cena samca 35000 zl samicy 38000zl Bardzo oswojone, wskakują na człowieka :) od najmłodszych tygodni mają kontakt z innymi zwierzętami, nie są to dzikusy z klatki... POSIADAJĄ PEŁNĄ DOKUMENTACJĘ POTWIERDZAJĄCĄ ICH LEGALNE POCHODZENIE - dokumentacja ta jest również potrzebna do rejestracji w urzędzie [TERMIN 14 DNI OD DNIA ZAKUPU MAŁPKI]. To naprawdę wspaniałe zwierzęta, które dają wiele emocji podczas obserwacji i codziennych zajęciach w ich towarzystwie. Dostępne samce oraz samiczki. Podana cena jest za sztukę i nie podlega negocjacji. Więcej informacji udzielę drogą telefoniczną. ZASTRZEGAMY SOBIE PRAWO DO ODMOWY SPROWADZENIA (SPRZEDAŻY) MAŁPKI JEŻELI UZNAMY, ŻE POTENCJALNY WŁAŚCICIEL NIE ZAPEWNI MAŁPCE DOBREGO DOMU - to są żywe zwierzęta, wymagają odpowiedniej opieki i poświęconego czasu, wybór (zakup) nie może opierać się na chwilowym kaprysie pod wpływem emocji ! PROSZĘ TYLKO I WYŁĄCZNIE O PRZEMYŚLANE DECYZJE - szczegółowych informacji oraz pomocy w utrzymywaniu tego gatunku udzielamy oczywiście przed zakupem jak i po zakupie, zależy nam na tym, aby zwierzęta miały się jak najlepiej w nowym domu. --------------------------------------------------- Posiadamy wieloletnią hodowlę między innymi serwali afrykańskich, kotów bengalskich oraz innych egzotycznych zwierząt. Ponadto oferujemy doradztwo w zakresie żywienia, behawioryzmu oraz warunków bytowych i przetrzymywania. Naszą hodowle zobaczycie na FB Aloona - hodowla zwierząt egzotycznych tagi: jeż, tenrek, tenrek mniejszy, niespotykane egzotyczne zwierze, kot, kot egzotyczny, wyjątkowa rasa kota, niespotykany kot, serval, serwal, egzotyczne zwierze, fenek, lis, lemur, lemur catta, lemur katta, bengal, kot bengalski, kot egzotyczny, wyjątkowa rasa kota, niespotykany kot, serval, serwal, egzotyczne zwierze, ryś, lynx, ocelot, asian leopard cat, lis, fenek, galago, gremlin, egzotyczne zwierze, egzotyczny ssak, lotopałanka, małpka, małpa, lemur, cebus apella, kapucynka, małpka kapucynka, Sapajus apella, Tufted capuchin, brown capuchin, black-capped capuchin, pin monkey ",Wrz 2016,20 Maj 14:30,https://sprzedajemy.pl/skrzynia-biegow-20dp35-fiat-peugeot-citroen-1-6-regeneracja-ryki-2-6bea9f-nr67631548
Plyta Skladanka ; HITS OF THE WORLD--J. WHITE 'LP winyl," MUZA SXL 0659, BDB. ODBIOR, WYSYLKA.; 1--3 LP= 15 zl. pytania na meila. ",Wrz 2018,20 Maj 14:36,https://sprzedajemy.pl/skrzynia-biegow-20dp35-fiat-peugeot-citroen-1-6-regeneracja-ryki-2-6bea9f-nr67631548
Pompa ciepłą Panasonic z montażem. Dofinansowanie Raty," OFERUJEMY POMPY CIEPŁA PANASONIC, KAISAI, ROTENSO, GALMET i inne o mocy 5-16kw ZAPEWNIAMY MONTAŻ, SERWIS 7/24 DOFINANSOWANIE RATY O nas – dlaczego warto ! Jesteśmy firmą od lat zajmującą się techniką grzewczą oraz fotowoltaiką. W naszym portfolio znajdują się pompy ciepła, fotowoltaika, kotły oraz instalacje wodne , sanitarne i gazowe. Tylko w ubiegłym roku zrealizowaliśmy setki projektów ( w tym wiele montaży pomp ciepła ) Posiadamy wykwalifikowaną kadrę specjalistów. Na każdym etapie współpracy służymy pomocą. Nasi specjaliści zaproponują najlepsze rozwiązania, pomogą w doborze urządzeń, sporządzeniu dokumentów o dofinansowanie, dokonają niezbędnych oględzin oraz przygotują spersonalizowaną pod Państwa potrzeby najlepszą ofertę. To co nas wyróżnia na tle konkurencji to: -wieloletnie doświadczenie przekładające się na jakość -doskonała obsługa (to klient jest naszym piorytetem) -krótkie terminy realizacji -posiadamy akredytację Panasonic, Kaisai, Rotenso, Galmet i wielu innych producentów -duży wybór produktów dostępnych od ręki -serwis 7 dni w tygodniu -gwarancja ODWIEDŹ NAS www.*************** ZAMIESZCZONE OGŁOSZENIE DOTYCZY POMPY CIEPŁA PANASONIC 7kW -1 FAZOWA (jeśli poszukujesz innej pompy ciepła zadzwoń i zapytaj) O PRODUKCIE - opis Pompa ciepła Panasonic Aquarea HIGH PERFORMANCE WH-MDC07J3E5 7 kW 1-FAZOWA Pompa ciepła to obecnie najbardziej popularny system do ogrzewania, chłodzenia i wytwarzania ciepłej wody użytkowej. Pompa ciepła znajduje zastosowanie w nowych, jak i modernizowanych budynkach z istniejącymi grzejnikami. Jej eksploatacja jest wyjątkowo opłacalna, a wpływ na środowisko naturalne minimalny, dlatego pompa ciepła stanowi idealną alternatywę dla starych kotłów. Najwyższy komfort, wydajność i energooszczędność Urządzenia do nowych i modernizowanych domów. Wydajna praca nawet przy skrajnie niskich temperaturach zewnętrznych. Bogaty wybór typów: Monoblok, Split, All in One, przy jednocześnie szerokiej ofercie mocy. MONOBLOK Urządzenia te charakteryzuje wysoka wydajność, gwarantowana przy temperaturach zewnętrznych sięgających do nawet - 20°C oraz brak konieczności stosowania dodatkowej grzałki dla utrzymania jej wydajności przy tak niskich temperaturach. Jest to niewątpliwy atut monoblokowych pomp ciepła marki Panasonic. Urządzenia te pobierają również znikomą ilość energii przy minimalnej emisji CO2. Oszczędność miejsca Pompy ciepła Aquarea High Performance typu monoblok to idealne rozwiązanie pozwalające na oszczędność miejsca w każdym domu, ponieważ nie wymagają zastosowania osobnego modułu Hydrokit. Dodatkowo, dzięki przemyślanej konstrukcji urządzenia, cały czynnik chłodniczy jest zamknięty w kompaktowej jednostce zewnętrznej, dzięki czemu w budynku prowadzona jest tylko instalacja grzewcza. Nowe jednostki Aquarea High Performance Generacji J typu monoblok, jednofazowe. Grzewczo- chłodzące – MDC • Czynnik chłodniczy R32 · Opcjonalne sterowanie za pomocą smartfona · Maksymalna temperatura wylotowa modułu hydraulicznego: 60°C · Wysoka wydajność grzewcza przy niskiej temperaturze zewnętrznej · Wysoka wydajność chłodnicza dla wysokiej temperatury zewnętrznej · Praca przy temperaturach sięgających nawet -20°C · Praca w trybie chłodzenia przy temperaturach zewnętrznych do 10°C · Wbudowany filtr magnetyczny Usługa montażu wyceniana indywidualnie - skontaktuj się w tej sprawie by ustalić szczegóły! Zamieszczona cena w ogłoszeniu jest ceną netto , należy doliczyć VAT 8% w przypadku zakupu z usługą montażu lub 23% w przypadku zakupu bez montażu. www.*************** ",Kwi 2023,20 Maj 14:36,https://sprzedajemy.pl/skrzynia-biegow-20dp35-fiat-peugeot-citroen-1-6-regeneracja-ryki-2-6bea9f-nr67631548
Toyota Celica IV klasyk 2.0 GTI," Sprzedam fajnego klasyka,czyli Toyotę Celicę 4genercji.Auto w dobrej kondycji blacharskiej,ale do poprawek,podłoga OK.Mechanicznie do poskładania.więcej informacji pod nr telefonu. ",Wrz 2016,20 Maj 14:20,https://sprzedajemy.pl/skrzynia-biegow-20dp35-fiat-peugeot-citroen-1-6-regeneracja-ryki-2-6bea9f-nr67631548
Fiat ducato jumper boxer 02 -06r przegub łożysko, Fiat ducato jumper boxer 02-06r przegub łożysko cena 50zl Kielce telefon 517''965''401 ,Mar 2022,20 Maj 14:14,https://sprzedajemy.pl/skrzynia-biegow-20dp35-fiat-peugeot-citroen-1-6-regeneracja-ryki-2-6bea9f-nr67631548
