title,desc,user_registered,offer_posted,url
Oryginalna bluza GAP z USA," Nowa z metkami bluza GAP ze sklepu firmowego w USA. Identyczna jak na zdjęciu. Posiadam rozmiar M, L i Xl. Odbiór osobisty lub wysyłka w zależności od potrzeby ",Sie 2016,20 Maj 14:21,https://sprzedajemy.pl/skrzynia-biegow-20dp35-fiat-peugeot-citroen-1-6-regeneracja-ryki-2-6bea9f-nr67631548
"JUŻ W 7 DNI! Domki letniskowe, wiaty, altany!"," CZAS REALIZACJI ZAMÓWIENIA JUŻ OD 7 DNI!  Witam serdecznie, Oferujemy Państwu wykonanie domków letniskowych, altan, sauny, wiat, zadaszeń, drewutni, pergol, tarasów i wszelkich zabudów oraz konstrukcji drewnianych. Wszystkie prace uzgadniamy z klientem indywidualnie aby jak najlepiej sprostać oczekiwaniom. Możliwy transport na terenie całej Europy.  Zapraszamy do kontaktu! ",Sty 2022,20 Maj 14:19,https://sprzedajemy.pl/skrzynia-biegow-20dp35-fiat-peugeot-citroen-1-6-regeneracja-ryki-2-6bea9f-nr67631548
fiat 126p maluch sprzegło koło zamchowe, Fiat 126p maluch sprzęgło tarcza docisk 7 koło zamachowe 70zl0zl Kielce telefon 517 965 401 ,Mar 2022,20 Maj 14:14,https://sprzedajemy.pl/skrzynia-biegow-20dp35-fiat-peugeot-citroen-1-6-regeneracja-ryki-2-6bea9f-nr67631548
"CITROEN Peugeot 2,0hdi RHR bagnet miarka oleju"," Citroen Peugeot 2,0hdi RHR bagnet miarka oleju cena 30zl Kielce telefon 517''965'''401 ",Mar 2022,20 Maj 14:15,https://sprzedajemy.pl/skrzynia-biegow-20dp35-fiat-peugeot-citroen-1-6-regeneracja-ryki-2-6bea9f-nr67631548
Czujnik NOX FORD Conect KV615E145AC BRATFORD RADOM, Części do Forda Bratford Radom ,Sty 2022,20 Maj 14:18,https://sprzedajemy.pl/skrzynia-biegow-20dp35-fiat-peugeot-citroen-1-6-regeneracja-ryki-2-6bea9f-nr67631548
PlytaSkladanka LP. 12 TOPS HITS FROM GREECE VOL. 1. Holland., PHILIPS DOSK. Odbior wysylka. ,Wrz 2018,20 Maj 14:35,https://sprzedajemy.pl/skrzynia-biegow-20dp35-fiat-peugeot-citroen-1-6-regeneracja-ryki-2-6bea9f-nr67631548
"Regał, biblioteka, komoda, pod TV wszystko na zamowienie"," Dzien dobry. Oferuję Panstwu sprzedaż mebli wykonywanych na zamówienie na konkretny wymiar, rodzaj i kolor . ********* Wszystkie fantazje ",Maj 2016,20 Maj 14:42,https://sprzedajemy.pl/skrzynia-biegow-20dp35-fiat-peugeot-citroen-1-6-regeneracja-ryki-2-6bea9f-nr67631548
Mieszkanie do wynajęcia 2 pokoje Puławy," Wynajmę mieszkanie 2 pokojowe zadbane, w pełni wyposażone dla spokojnych lokatorów. Mieszkanie znajduje się w dobrej lokalizacji. OPŁATY: 1100ZŁ + OPŁATY (OK. 700ZŁ) + 1500ZŁ KAUCJA ",Lut 2014,20 Maj 14:34,https://sprzedajemy.pl/skrzynia-biegow-20dp35-fiat-peugeot-citroen-1-6-regeneracja-ryki-2-6bea9f-nr67631548
"Winylowa LP,Jazz; Papa Bues Viking Jazz-Band .", amiga 1971 r. dosk. Odbior wysylka. ,Wrz 2018,20 Maj 14:36,https://sprzedajemy.pl/skrzynia-biegow-20dp35-fiat-peugeot-citroen-1-6-regeneracja-ryki-2-6bea9f-nr67631548
"Domek na makietę Nr.6 , kolejka , skala TT"," Domek w skali TT . Pochodzi z demontażu makiety , po naprawie , posiada ślady użytkowania. Wysokość 7 cm, Wysyłka poczta 14 zł lub inPost 19 zł po wpłacie na konto chętnie odbiór osobisty Łódź-Stoki (okolice Janosika-Telefoniczna) UWAGA Jak ogłoszenie jest widoczne to jest aktualne . ",Mar 2017,20 Maj 14:14,https://sprzedajemy.pl/skrzynia-biegow-20dp35-fiat-peugeot-citroen-1-6-regeneracja-ryki-2-6bea9f-nr67631548
"Plyta LP ,skladanka ; LESZEK BOGDANOWICZ --MOTEL ."," MUZA SX 2401 ,DOSK. Odbior wysylka.Koszt wysylki ; 1-3 plyt= 15 zl. Pytania na meila. ",Wrz 2018,20 Maj 14:35,https://sprzedajemy.pl/skrzynia-biegow-20dp35-fiat-peugeot-citroen-1-6-regeneracja-ryki-2-6bea9f-nr67631548
"SUZUKI GRAND VITARA II 1,9ddis skrzynka bezpieczników"," SUZUKI GRAND VITARA II 1,9DDIS skrzynka bezpieczników cena 50zl Kielce telefon 517--965--401 ",Mar 2022,20 Maj 14:13,https://sprzedajemy.pl/skrzynia-biegow-20dp35-fiat-peugeot-citroen-1-6-regeneracja-ryki-2-6bea9f-nr67631548
Main BN41-01603B do Samsung LE 40 D 550, Płyta dedykowana do telewizora LCD marki SAMSUNG o wymiarach ekranu 40'' z modelu Samsung LE 40 D 550 Przesyłka 15 zł a przy wpłacie 10zł. 100% sprawny. ,Maj 2017,20 Maj 14:31,https://sprzedajemy.pl/skrzynia-biegow-20dp35-fiat-peugeot-citroen-1-6-regeneracja-ryki-2-6bea9f-nr67631548
Półka angielska. Meble Henryków, Używana półka/regał produkcji ZWMA HENRYKÓW w bardzo dobrym stanie. Drewno mahoniowe. Bardzo pojemna. ,Gru 2017,20 Maj 14:42,https://sprzedajemy.pl/skrzynia-biegow-20dp35-fiat-peugeot-citroen-1-6-regeneracja-ryki-2-6bea9f-nr67631548
Glebogryzarka Husqvarna," Sprzedam profesjonalną oryginalną glebogryzarkę HUSQVARNA CRT 81 prod. USA, szerokość wirnika 55 cm, stan bardzo dobry, bez luzów, świetny silnik Subaru zapala od razu, bez wycieków, pracuje równo przy najwyższym komforcie pracy, może nią obsługiwać każdy, nawet jedną ręką, szczerze polecam, tel.*********. ",Paź 2021,20 Maj 14:39,https://sprzedajemy.pl/skrzynia-biegow-20dp35-fiat-peugeot-citroen-1-6-regeneracja-ryki-2-6bea9f-nr67631548
PEUGEOT J5 DUCATO C25 klamka wewnętrzna srodkowa, PEUGEOT J5 DUCATO C25 klamka wewnętrzna srodkowa cena 50zl sztuka Kielce telefon 417---965--401 ,Mar 2022,20 Maj 14:14,https://sprzedajemy.pl/skrzynia-biegow-20dp35-fiat-peugeot-citroen-1-6-regeneracja-ryki-2-6bea9f-nr67631548
AUDI A4. Model 2011 rok. 2.0 TDI 143 KM. Bezwypadkowy, Audi A4 Kombi. Rok prod: 2010. XII. 23. Model roku 2011. 2.0 TDI 143 KM. Najlepszy silnik. Auto bezwypadkowe. Oryginalny lakier. Pełna dokumentacja. 2 kpl kluczyków. Zapraszam. Tel: *** *** ***. ,Cze 2011,20 Maj 14:17,https://sprzedajemy.pl/skrzynia-biegow-20dp35-fiat-peugeot-citroen-1-6-regeneracja-ryki-2-6bea9f-nr67631548
Kamera cofania MAXICAM VW Lupo Polo Golf Passat EOS," Dedykowana kamera cofania do samochodów marki ; OPEL : - Vectra C kombi SEAT - Leon 2 od 2006, - Ibiza Cupra od 2009, - Exeo od 2009, - Altea od 2007, - Altea XL. VW: - Lupo 1999 - 2006 - Polo 2000 - 2009 - Golf 4, 5, 6 hatchback - Passat B6 2005 - 2009 sedan - Passat CC - EOS Kamera jest DEDYKOWANA do danego modelu auta - oznacza to, że kamera dokładnie pasuje do miejsca, w którym ma być zamontowana. Ponadto, co bardzo istotne, kamera stanowi jedną całość z całym korpusem, co zdecydowanie wpływa na jej wytrzymałość i solidność. Żeby zamontować kamerę nie ma potrzeby wiercenia otworów w zderzaku czy klapie bagażnika. Montaż urządzenia jest całkowicie bezinwazyjny dla nadwozia samochodu, ponieważ kamerę montuje się w miejscu lampki oświetlenia rejestracji. Nie tracimy przy tym oświetlenia tablicy, gdyż kamera posiada wbudowane podświetlenie LED. Kamera cofania 9538 VW Lupo Polo Golf Passat EOS Numer katalogowy producenta CA-9538 Marka Maxicam Model 9538 NTSC Przetwornik 1/3.6"" kolor CMOS OV7959 Zasilanie DC 12V Kąt widzenia 170° Praca w systemie NTSC Rozdzielczość 648 x 488 Klatek na sekundę Nie Liczba linii 420 TVL Minimalne oświetlenie 0,3 Lux Pobór mocy 168 mW Temperatura pracy -20 ~ +70 Wodoodporność IP68 Dodatkowe opcje Funkcja Mirror, Elektroniczna skala odległości ",Wrz 2016,20 Maj 14:25,https://sprzedajemy.pl/skrzynia-biegow-20dp35-fiat-peugeot-citroen-1-6-regeneracja-ryki-2-6bea9f-nr67631548
"Drewniany pawilon handlowy, domek letniskowy"," Witam serdecznie! Oferujemy Państwu solidnie wykonany drewniany pawilon handlowy o wymiarach 2x3m. Pawilon posiada drewnianą podłogę, dach pokryty gontem (kolor ustalany indywidualnie). Może on służyć również jako domek letniskowy. Istnieje możliwość dostosowania zabudowy do własnych potrzeb (cena ustalana indywidualnie). Wykonujemy również domy szkieletowe całoroczne i letniskowe, altany, wiaty i wszelkie zabudowy drewniane. Zapraszam do kontaktu *********. ",Sty 2022,20 Maj 14:18,https://sprzedajemy.pl/skrzynia-biegow-20dp35-fiat-peugeot-citroen-1-6-regeneracja-ryki-2-6bea9f-nr67631548
silnik elektryczny 3kW 2900obr. 3fazowy 100B3," silnik elektryczny trójfazowy 3kW 2900obr. OMEC MOTORS (nowy) średnica wału: 28mm wielkość mechaniczna: 100 (możliwy montaż: B3, B34, B35, B14, B5) waga: 24kg wystawiamy faktury VAT cena BRUTTO GWARANCJA 2 lata wysyłka kurierem: przelew: 23zł pobranie: 27zł więcej silników znajdziesz w naszych ogłoszeniach ",Mar 2018,20 Maj 14:29,https://sprzedajemy.pl/skrzynia-biegow-20dp35-fiat-peugeot-citroen-1-6-regeneracja-ryki-2-6bea9f-nr67631548
SKRZYNIA BIEGÓW SCANIA GR875R, SKRZYNIA BIEGÓW SCANIA GR875R CENA NETTO: 18000 CENA BRUTTO: 22140 SKRZYNIA BIEGÓW PO WYMIANIE SYNCHRONIZATORÓW Na pozostałych naszych aukcjach znajdą Państwo wszystkie części do SCANIA i DAF. ,Wrz 2022,20 Maj 14:37,https://sprzedajemy.pl/skrzynia-biegow-20dp35-fiat-peugeot-citroen-1-6-regeneracja-ryki-2-6bea9f-nr67631548
Moduł BC.0161699.D 9TDH.A1 NEW HOLLAND 47488103, Nowy oryginalny BRATFORD RADOM ,Sty 2022,20 Maj 14:34,https://sprzedajemy.pl/skrzynia-biegow-20dp35-fiat-peugeot-citroen-1-6-regeneracja-ryki-2-6bea9f-nr67631548
Moduł IR SPAD_401 Rx+LED do TV Sharp LC-32CHE5100E, !00% sprawny Przy wpłacie przesyłka 10zł ,Maj 2017,20 Maj 14:31,https://sprzedajemy.pl/skrzynia-biegow-20dp35-fiat-peugeot-citroen-1-6-regeneracja-ryki-2-6bea9f-nr67631548
Rowerek Biegowy Kinderkraft 2way Next Lublin Czuby," Jeśli czytasz to ogłoszenie znaczy to, że jest AKTUALNE. Rowerek Biegowy Kinderkraft 2way Next Lublin Czuby Sprzedam Rowerek Biegowy Kinderkraft 2way Next. Rowerek posiada normalne ślady użytkowania, lekkie otarcie, mimo tego jest w dobrym stanie, wymaga wyczyszczenia. Cena ostateczna, bez negocjacji, nie wysyłam, nie zamieniam. Na sms/czat nie odpisuje, nie sprawdzam. Kontakt telefoniczny 10-20. Tylko odbiór osobisty – Lublin Czuby. ",Wrz 2017,20 Maj 14:33,https://sprzedajemy.pl/skrzynia-biegow-20dp35-fiat-peugeot-citroen-1-6-regeneracja-ryki-2-6bea9f-nr67631548
bransoletka skórzana szeroka szachownica biało czarna," Sprzedam stylową szeroką bransoletkę w kolorze biało-czarnym szachownica. Bransoletka wykonana z materiału skóropodobnego, zapięcia w kolorze złotym. Długość bransoletki 21 cm, szerokość 4 cm. Polecam bo jest bardzo oryginalna i pięknie prezentuje się na ręce! Przesyłka tylko 6 zł list polecony! ",Sie 2015,20 Maj 14:24,https://sprzedajemy.pl/skrzynia-biegow-20dp35-fiat-peugeot-citroen-1-6-regeneracja-ryki-2-6bea9f-nr67631548
Skoda Rapid. 2016 rok. Benz + GAZ. 110 KM. 6 biegów. Bezwypa," Skoda Rapid spaceback. Rok prod: 2016. 1.2 Benz + Gaz. 110 KM. 6 biegów. Najlepszy silnik Podgrzewane fotele, klimatyzacja, czujniki parkowania, skórzana wielofunkcyjna kierownica, elektryczne szyby z 4, elektryczne i podgrzewane lusterka, halogeny i wiele innych. Auto bezwypadkowe, oryginalny lakier. Pełna dokumentacja. 2 kpl kluczyków. Bardzo dobry stan techniczny i wizualny. Zapraszam. Tel: *** *** ***. ",Cze 2011,20 Maj 14:17,https://sprzedajemy.pl/skrzynia-biegow-20dp35-fiat-peugeot-citroen-1-6-regeneracja-ryki-2-6bea9f-nr67631548
DRZWI TYLNE TYŁ H3 PRAWE DUCATO JUMPER BOXER MOVANO 06-," DRZWI TYLNE TYŁ H3 PRAWE DUCATO JUMPER BOXER MOVANO 06-22 Cena: 2 200,00 zł Faktura VAT 23% Cena brutto: 2 706,00 zł MARKA: FIAT, PEUGEOT, CITROEN, OPEL MODEL: DUCATO, BOXER, JUMPER, MOVANO ROK: 2006-2022 KRAJ POCHODZENIA: FRANCJA(DEMONTAŻ) TYP: DRZWI TYLNE PRAWE GOŁE ORYGINAŁ  PRODUCENT: FIAT SPRAWNA: TAK  STAN: NOWY (ROK 2022) (ZDEMONTOWANY Z NOWYCH AUT) LOGO PEUGEOT GABARYT: ODBIÓR OSOBISTY STAN MAGAZYNOWY: 40SZT RÓŻNE KOLORY DO WYBORU H3 POSIADAMY CZĘŚCI DO TYCH MODELI SAMOCHODÓW ",Cze 2015,20 Maj 14:36,https://sprzedajemy.pl/skrzynia-biegow-20dp35-fiat-peugeot-citroen-1-6-regeneracja-ryki-2-6bea9f-nr67631548
Czujnik Nox VW SEAT SKODA 05L907807Q NOWY ORGINALNY, Części do samochodów Bratford Radom ,Sty 2022,20 Maj 14:16,https://sprzedajemy.pl/skrzynia-biegow-20dp35-fiat-peugeot-citroen-1-6-regeneracja-ryki-2-6bea9f-nr67631548
"FIAT UNO TIPO TEMPRA  1,4 1,6 pompa wspomagania"," FIAT UNO TIPO TEMPRA 1,4 1,6 pompa wspomagania cena 50zl Kielce telefon 517--965--401 ",Mar 2022,20 Maj 14:15,https://sprzedajemy.pl/skrzynia-biegow-20dp35-fiat-peugeot-citroen-1-6-regeneracja-ryki-2-6bea9f-nr67631548
Sprzedam koła," Sprzedam koła 16 do siewnika, cena za komplet 330 złotych. ",Kwi 2023,20 Maj 14:38,https://sprzedajemy.pl/skrzynia-biegow-20dp35-fiat-peugeot-citroen-1-6-regeneracja-ryki-2-6bea9f-nr67631548
"Mercedes E klasa W  211 2,7 CDI 2003 r"," Auto zadbane , dobry mocny , oszczędny silnik diesla , wszystko sprawne , bez oznaków korozji , auto Ok. ",Cze 2011,20 Maj 14:33,https://sprzedajemy.pl/skrzynia-biegow-20dp35-fiat-peugeot-citroen-1-6-regeneracja-ryki-2-6bea9f-nr67631548
Tage Der Solidaritat - Karta Solidarność Wałęsa Stocznia," Witam serdecznie, Do sprzedania książka ""Tage Der Solidaritat"" - bogato ilustrowana historia ruchu ""Solidarność"", przeznaczona dla czytelników niemieckojęzycznych. Wydawca: Ośrodek KARTA Rok wydania: 2005 Autor: praca zbiorowa pod redakcją Katarzyny Madoń-Mitzner Ilość stron: 106 Oprawa: miękka Papier: kredowy, błyszczący Język: niemiecki STAN: Idealny, książka jak nowa - nigdy nie była czytana. PŁATNOŚĆ, ODBIÓR, WYSYŁKA: Zakup możliwy poprzez kontakt przez wiadomość prywatną, gdzie sprzedający i kupujący uzgodnią warunki transakcji. Możliwy (i mile widziany) odbiór osobisty w Starej Wsi koło Brzozowa (woj. podkarpackie). Wysyłka możliwa po wcześniejszej przedpłacie na konto bankowe. Koszt: 10 zł (list polecony) Nie wysyłam za pobraniem ani paczkomatami. Serdecznie zapraszam do zakupu oraz przejrzenia pozostałych moich ogłoszeń! ",Mar 2021,20 Maj 14:26,https://sprzedajemy.pl/skrzynia-biegow-20dp35-fiat-peugeot-citroen-1-6-regeneracja-ryki-2-6bea9f-nr67631548
Koszulka dla dziewczynki, Do sprzedania koszulka dla dziewczyni.Odbiór Borek Fałęcki. ,Cze 2014,20 Maj 14:17,https://sprzedajemy.pl/skrzynia-biegow-20dp35-fiat-peugeot-citroen-1-6-regeneracja-ryki-2-6bea9f-nr67631548
Pilot UPC, Pilot używany w pełni sprawny ! ,Mar 2014,20 Maj 14:15,https://sprzedajemy.pl/skrzynia-biegow-20dp35-fiat-peugeot-citroen-1-6-regeneracja-ryki-2-6bea9f-nr67631548
Wyjątkowy dom 394 m2 / wysoki standard / Wawrzyny," Na sprzedaż wyjątkowy dom położony w najbardziej pożądanej lokalizacji w Bartoszycach. Nieruchomość to idealna propozycja dla wymagających klientów szukających niebanalnych wnętrz. Lokalizacja Nieruchomość zlokalizowana jest na przedmieściach Bartoszyc w Wawrzynach, które są niewielką kolonią położoną w powiecie bartoszyckim w woj. warmińsko-mazurskim. W najbliższym otoczeniu przeważa prestiżowa zabudowa jednorodzinna. Wjazd do nieruchomości możliwy jest poprzez drogę krajową 51 od strony Połęcza. W planach jest przebudowa drogi prowadzącej pod posesje, która ma zostać wyłożona kostką brukową. W najbliższej odległości znajdują się: Bartoszyce – 1 km, Lidzbark Warmiński – 20 km, Olsztyn – 69 km, Warszawa – 290 km.  Dom Dom wolnostojący parterowy z poddaszem użytkowym o powierzchni 394 m2 wybudowany w 2012 roku. Szczegółowy wykaz pomieszczeń: Parter: garaż, salon z wyjściem na taras, kuchnia z jadalnią, łazienka z wc, pralnia, hol Piętro: 4 pokoje w tym jeden z łazienką, łazienka z wc, garderoba z wejściem na strych Każde pomieszczenie na piętrze posiada wyjście na balkon lub taras. Za ogrzewanie i podgrzanie wody odpowiada gruntowa pompa ciepła posiadająca cztery pionowe odwierty o głębokości 100 metrów. W całym domu rozprowadzone jest ogrzewanie podłogowe włącznie z garażem. Na dachu w 2023 roku zostały zainstalowane panele fotowoltaiczne o mocy 10 kW. Zimowe wieczory umili kominek umiejscowiony w salonie. Nieruchomość podłączona jest do wodociągu gminnego natomiast ścieki odprowadzane są do kanalizacji miejskiej. Dom wyposażony jest następujące zabezpieczenia: alarm, rolety zewnętrzne na piętrze oraz okna antywłamaniowe na parterze. We frontowej części posesji usytuowany jest niewielki budynek służący jako wiata śmietnikowa oraz pomieszczenie gospodarcze, natomiast za domem znajduje się drewutnia, która wykorzystywana jest do przechowywania narzędzi. Działka W skład nieruchomości wchodzi działka o łącznej powierzchni 955 m2. Działka jest pięknie zagospodarowana, na której znajdują się głównie ozdobne krzewy zapewniające prywatność. Działka jest w całości ogrodzona, a jej frontowa część to ozdobny płot z automatyczną bramą. Pomagamy w uzyskaniu kredytu na prezentowaną nieruchomość. Oferta biura nieruchomości – Mikołajczyk Nieruchomości. Zapraszamy na prezentację. ",Wrz 2021,20 Maj 14:14,https://sprzedajemy.pl/skrzynia-biegow-20dp35-fiat-peugeot-citroen-1-6-regeneracja-ryki-2-6bea9f-nr67631548
"Plyta LP, Skladanka ; Jaroslaw Kukulski i jego przeboje ."," Muza SX 2214, DOSK. Odbior wysylka.Koszt wysylki ; 1-3 plyt = 15 z; Pytania na meila. ",Wrz 2018,20 Maj 14:35,https://sprzedajemy.pl/skrzynia-biegow-20dp35-fiat-peugeot-citroen-1-6-regeneracja-ryki-2-6bea9f-nr67631548
Hyundai Getz fotel przód tył kanapa komplet, Hyundai getz 5-drzwiowy komplet foteli przod tył cena 300zl Kielce telefon 517 965 401 ,Mar 2022,20 Maj 14:14,https://sprzedajemy.pl/skrzynia-biegow-20dp35-fiat-peugeot-citroen-1-6-regeneracja-ryki-2-6bea9f-nr67631548
Nicolett tunika 56/58," Głęboka czerń,szwy płaskie,uniwersalne użytkowanie w rozmiarze 3 XL,z wiskozy, rozciągająca się. Biust 144 cm Długość całkowita 93 cm Biodra do 160 Brak śladów użytkowania ",Wrz 2022,20 Maj 14:40,https://sprzedajemy.pl/skrzynia-biegow-20dp35-fiat-peugeot-citroen-1-6-regeneracja-ryki-2-6bea9f-nr67631548
PEUGEOT 106 lampa tył lewa, PEUGEOT 106 lampa tył lewa cena 25zl Kielce telefon 517---965---401 ,Mar 2022,20 Maj 14:15,https://sprzedajemy.pl/skrzynia-biegow-20dp35-fiat-peugeot-citroen-1-6-regeneracja-ryki-2-6bea9f-nr67631548
Fiat 125p Polonez FELGA 13 cali, Fiat 125p polonez felga 13 cali cena 75zl Kielce telefon 517 965 401 ,Mar 2022,20 Maj 14:14,https://sprzedajemy.pl/skrzynia-biegow-20dp35-fiat-peugeot-citroen-1-6-regeneracja-ryki-2-6bea9f-nr67631548
"SUZUKI GRAND VITARA II 1,9 licznik zegary obudowa"," SUZUKI GRAND VITARA II 1,9DDIS licznik 50zl anglik obudowa licznika 40zl Kielce telefon 517--965--401 ",Mar 2022,20 Maj 14:13,https://sprzedajemy.pl/skrzynia-biegow-20dp35-fiat-peugeot-citroen-1-6-regeneracja-ryki-2-6bea9f-nr67631548
"Przyczepa platforma 2,0x4,5"," Nowa przyczepa platforma dwie osie opony 175x13 DMC 750 , waga 320 , osie po 750 kg ",Lip 2011,20 Maj 14:21,https://sprzedajemy.pl/skrzynia-biegow-20dp35-fiat-peugeot-citroen-1-6-regeneracja-ryki-2-6bea9f-nr67631548
Matryca  MD30800DEN  T315X32SS, Uszkodzone podświetlanie Led ,Maj 2017,20 Maj 14:32,https://sprzedajemy.pl/skrzynia-biegow-20dp35-fiat-peugeot-citroen-1-6-regeneracja-ryki-2-6bea9f-nr67631548
DAEWOO NEXIA lampa tył prawa, DAEWOO NEXIA lampa tył prawa cena 50zl Kielce telefon 517--965---401 ,Mar 2022,20 Maj 14:15,https://sprzedajemy.pl/skrzynia-biegow-20dp35-fiat-peugeot-citroen-1-6-regeneracja-ryki-2-6bea9f-nr67631548
Pilot do LG 32 LH2010, Sprawny jak nowy ,Maj 2017,20 Maj 14:32,https://sprzedajemy.pl/skrzynia-biegow-20dp35-fiat-peugeot-citroen-1-6-regeneracja-ryki-2-6bea9f-nr67631548
LP.; TOP HITS '71; CLARIPHON., Bardzo dibry. Koszt wysylki; 1--3 LP= 15 ZL. ,Wrz 2018,20 Maj 14:35,https://sprzedajemy.pl/skrzynia-biegow-20dp35-fiat-peugeot-citroen-1-6-regeneracja-ryki-2-6bea9f-nr67631548
Logika LC370WX4-SLA 1 6870C-0158A, Przesyłka w cenie ,Maj 2017,20 Maj 14:30,https://sprzedajemy.pl/skrzynia-biegow-20dp35-fiat-peugeot-citroen-1-6-regeneracja-ryki-2-6bea9f-nr67631548
Pasy transportowe nowe, Pasy transportowe 20sztuk nowe 10metrowe z dużą klamrą typu ergo odbiór w Suwałkach lub możliwość wysyłki ,Lis 2015,20 Maj 14:29,https://sprzedajemy.pl/skrzynia-biegow-20dp35-fiat-peugeot-citroen-1-6-regeneracja-ryki-2-6bea9f-nr67631548
MAIN do SHARP LC55CUF8472ES T.MS6488E.U703, MAIN do SHARP LC55 T.MS6488E.U703 Przy wpłacie przesyłka w cenie ,Maj 2017,20 Maj 14:32,https://sprzedajemy.pl/skrzynia-biegow-20dp35-fiat-peugeot-citroen-1-6-regeneracja-ryki-2-6bea9f-nr67631548
Kontener techniczny aluminiowy," Kontener techniczny aluminiowy, zdjęty z Iveco, otwierany z trzech stron z dwoma uchwytami zjeżdżanymi na dwie drabiny. ",Gru 2015,20 Maj 14:30,https://sprzedajemy.pl/skrzynia-biegow-20dp35-fiat-peugeot-citroen-1-6-regeneracja-ryki-2-6bea9f-nr67631548
JEDYNE w Europie Beats studio by Dr.Dre," Posiadam słuchawki Dr.Dre wersja demo, zasilane zasilaczem oficjalnie nigdy nie były w sprzedaży. Pasmo dźwięku niesamowite, idealne dla kogoś kto pracuje przy obróbce muzyki. Polecam gorąco. Cena do negocjacji. ",Lip 2021,20 Maj 14:23,https://sprzedajemy.pl/skrzynia-biegow-20dp35-fiat-peugeot-citroen-1-6-regeneracja-ryki-2-6bea9f-nr67631548
"OPEL VECTRA OMEGA SINTRA 2,5 V6 pompa wspomagania"," OPEL VECTRA SINTRA OMEGA 2,5 V6 pompa wspomagania cena 50zl Kielce telefon 517---965---401 ",Mar 2022,20 Maj 14:15,https://sprzedajemy.pl/skrzynia-biegow-20dp35-fiat-peugeot-citroen-1-6-regeneracja-ryki-2-6bea9f-nr67631548
EGR FORD EDGE JG9Q9U438AC 2508735 BRATFORD RADOM, Części do Forda Bratford Radom ,Sty 2022,20 Maj 14:18,https://sprzedajemy.pl/skrzynia-biegow-20dp35-fiat-peugeot-citroen-1-6-regeneracja-ryki-2-6bea9f-nr67631548
Damska bluza kangura z kapturem, Do sprzedania mało używana bluza damska kangura z kapturem i dużą kieszenią.biala.ciepla.cena do negocjacji ,Lip 2022,20 Maj 14:15,https://sprzedajemy.pl/skrzynia-biegow-20dp35-fiat-peugeot-citroen-1-6-regeneracja-ryki-2-6bea9f-nr67631548
Telewizor LG 32LK450 32 cale FullHD 3x HDMI USB DivX," Sprzedam mało używany 32 calowy telewizor firmy LG. Telewizor jest w bardzo dobrym stanie, zarówno optycznym jak i technicznym. Wysyłka telewizora: GRATIS.  DANE TECHNICZNE:  Rozmiar ekranu: 32 cale / 80 cm Rozdzielczość: Full HD / 1920 x 1080 Tuner DVB-T i DVB-C, analogowy Kontrast dynamiczny: 100000 :1 Czas reakcji matrycy: 4 ms Funkcje poprawy obrazu: Dual XD Engine, Intelligent Sensor, 24p Real Cinema, Picture Wizard II  System i moc głośników: 2 x 10 W System dźwięku przestrzennego: Infinite Surround Regulacja tonów: tak Korektor dźwięku: tak Technologie dźwięku: Clear Voice II (Czysty Głos), Dolby Digital Plus, Dolby Pulse Menu w języku polskim : tak Telegazeta: tak Wejscie USB: tak Liczba złączy HDMI: 3x Liczba złączy USB: 1x Złącze EURO: 1x Wejście komponentowe: tak Złącze VGA: tak Cyfrowe wyjście optyczne: tak Wyjście słuchawkowe: tak Kolor obudowy: czarny Możliwość montażu na ścianie: tak / VESA 200x200 mm Wymiary z podstawą (szer. x wys.x gł.) : 79,5 x 56,8 x 20,7 cm Wymiary bez podstawy (szer. x wys.x gł.) : 79,5 x 50,4 x 7,4 cm Waga z podstawą / bez podstawy: 9,2 kg / 8,1 kg Wyposażenie i akcesoria: pilot, 2x baterie AAA do pilota, podstawa (możliwość obrotu), instrukcja obsługi, karta gwarancyjna, oryginalne opakowanie ",Mar 2020,20 Maj 14:20,https://sprzedajemy.pl/skrzynia-biegow-20dp35-fiat-peugeot-citroen-1-6-regeneracja-ryki-2-6bea9f-nr67631548
Oryginał puszka wfm (wsk shl), Witam sprzedam oryginalną puszkę narzędziową do pierwszych modeli wfm WSK shl stan fajny jak na zdjęciach kontakt tylko telefoniczny ,Lip 2016,20 Maj 14:22,https://sprzedajemy.pl/skrzynia-biegow-20dp35-fiat-peugeot-citroen-1-6-regeneracja-ryki-2-6bea9f-nr67631548
SREBRNA OBRĄCZKA PRÓBY 925 [gru]," SREBRNA OBRĄCZKA PRÓBY 925 Krótka Specyfikacja: Stan produktu: Używany Próba: 925 Waga: 2,33g Rozmiar: 19 Możliwa wysyłka jak i odbiór osobisty DANE KONTAKTOWE FHU JOKER ELBLĄG ul. Grunwaldzka 69/2 Otwarci od Poniedziałku do Soboty w godzinach 8:00 - 20:00 ",Sie 2019,20 Maj 14:12,https://sprzedajemy.pl/skrzynia-biegow-20dp35-fiat-peugeot-citroen-1-6-regeneracja-ryki-2-6bea9f-nr67631548
Obrysowka bmw e38 wysylka, Obrysowka bmw e38 Mozliwa wysylka W razie pytan prosze o kontakt ,Lis 2016,20 Maj 14:36,https://sprzedajemy.pl/skrzynia-biegow-20dp35-fiat-peugeot-citroen-1-6-regeneracja-ryki-2-6bea9f-nr67631548
Przyczepa wywrotka," Przyczepa jednoosiowa wywrotka na 3 strony wymiary paki 220x160x100 cm posiada instal elektryczną , lampy , hydraulike kpl do wywrotu , oś na bliżniaku ",Maj 2011,20 Maj 14:19,https://sprzedajemy.pl/skrzynia-biegow-20dp35-fiat-peugeot-citroen-1-6-regeneracja-ryki-2-6bea9f-nr67631548
Subaru Impreza I błotnik przód, Subaru Impreza I błotnik przód cena 200zl sztuka Kielce telefon 517 965 401 ,Mar 2022,20 Maj 14:14,https://sprzedajemy.pl/skrzynia-biegow-20dp35-fiat-peugeot-citroen-1-6-regeneracja-ryki-2-6bea9f-nr67631548
Subaru Impreza I lampa przód prawa lewa, Subaru Impreza I lampa przód cena 200zl sztuka Kielce telefon 517 965 401 ,Mar 2022,20 Maj 14:14,https://sprzedajemy.pl/skrzynia-biegow-20dp35-fiat-peugeot-citroen-1-6-regeneracja-ryki-2-6bea9f-nr67631548
ZACZEP JOHN DEERE," Zastosowanie: John Deere: 1654, 1854, 6105R, 6115R, 6125R, 6130R, 6140R, 6150M, 6150R, 6165J, 6170M, 6170R, 6175R, 6180J, 6195R, 6215R, 6800, 6810, 6820, 6830, 6930, 6J-1704, 6J-1904, 7330, 7420, 7430, 7530, SE6920 Nr. Katalogowy: L115073 ",Kwi 2018,20 Maj 14:39,https://sprzedajemy.pl/skrzynia-biegow-20dp35-fiat-peugeot-citroen-1-6-regeneracja-ryki-2-6bea9f-nr67631548
"recepcja, lada,bar  kazdy  wymiar kolor rodzaj wg życzenia"," Dzien dobry. Oferuję Państwu wykonanie , lady, recepcji baru , każdy kolor , wymiar i rodzaj. Wszystkie meble ze zdjęć są nowe , wykonuję je z nowego materiału, na wymiar,kolor i rodzaj , wszystko możliwe Pozdrawiam Janusz 5 0 6 1 3 3 8 6 8  Toruń ",Maj 2016,20 Maj 14:41,https://sprzedajemy.pl/skrzynia-biegow-20dp35-fiat-peugeot-citroen-1-6-regeneracja-ryki-2-6bea9f-nr67631548
Bransoletka na nogę dreams," Bransoletka na nogę Dream ,wykonana ze stali nierdzewnej o kolorze złotym. Długość 21cm.+4cm.regulacji.  Cena: 19 zł. ",Sty 2022,20 Maj 14:23,https://sprzedajemy.pl/skrzynia-biegow-20dp35-fiat-peugeot-citroen-1-6-regeneracja-ryki-2-6bea9f-nr67631548
